input,category,context,filter
ROYALWAY Camping HikingShirts Quick Dry Breathable Checked#RIM7101BS,Shirts,Shirts RIM7101BS,['Brand Name:ROYALWAY']
Adult/Kid Football Training Vest Soccer Jerseys Football Vest Soccer Training Vest Sports Pinnies Lot of 6 Pieces Wholesale,Shirts,Shirts,"['Fabric Type:Jersey', 'Sport Type:Soccer']"
2018 Summer Fishing Shirt Men Fishing Jacket Sunscreen Breathable Fishing Clothes Long-sleeved Uv Hiking Shirts Pius Size 3XL,Shirts,Shirts,"['Gender:Men', 'Feature:Breathable']"
Women Yoga Shirts Sexy Sports Breathable Yoga Tops Women Short Sleeve Cover Up Backless T-Shirt Thin Loose Sport Tee Gym Fitness,Shirts,Shirts Women Yoga Shirts Sexy Sports Breathable Yoga Tops,"['Sport Type:Yoga', 'Sleeve Length(cm):Short', 'Gender:Women']"
Men&#39;s Black/Red Cheap Print Jersey 23 Lebron James Top Quality Uniforms Sports Basketball Jerseys Breathable Training Shirts,Shirts,Shirts,"['Sport Type:Basketball', 'Gender:Men']"
Kawasaki Original Custom Men Reversible Basketball Uniform Sets Custom Plus Size S-4XL Practice Jerseys Basketball Short  ,Shirts,Shirts,"['Sport Type:Basketball', 'Gender:Men']"
2017 New Women Sexy Sports Tank Running Tops Yoga Sport Fitness Exercise Jogging Gym Yoga Vest Suits Yoga Shirts For Sexy Women,Shirts,Shirts,"['Gender:Women', 'Sport Type:Yoga']"
PIERCE #34 Basketball Jersey KANSAS Academy Mens Basketball Throwback Stitched Jerseys Blue Basket Sportswear Cheap Retro Shirt,Shirts,Shirts,"['Sport Type:Basketball', 'Gender:Men', 'Style:Retro']"
Li-Ning Men BAD FIVE Basketball Jerseys Breathable 100% Cotton Regular Fit LiNing Fitness Sports T-Shirts Tops AHSN305 MTS2826,Shirts,Shirts,"['Sport Type:Basketball', 'Gender:Men', 'Feature:Breathable', 'Material:Cotton']"
VTURE Basketball T-shirts #23 Tournament Shootout Basketball Jerseys,Shirts,Shirts,"['Sport Type:Basketball', 'Brand Name:VTURE']"
Li-Ning Men CJ. Basketball Jerseys 100% Cotton Breathable Printing Comfort Regular Fit LiNing Sports T-Shirt AHSN919 MTS2840,Shirts,Shirts AHSN919,"['Sport Type:Basketball', 'Gender:Men', 'Feature:Breathable', 'Material:Cotton']"
2018 DeMatha Catholic HS Stags #20 Markelle Fultz Jersey Throwback Basketball Jerseys Retro Vintage Stitched Shirts for Men Blue,Shirts,Shirts Markelle Fultz,"['Gender:Men', 'Fabric Type:Jersey', 'Sport Type:Basketball', 'Color:Blue']"
Stitched Basketball Jersey One Tree Hill  Jersey 23 Nathan Scott 3 Lucas Scott Ravens Movie Jerseys White Black Blue S-3xl,Shirts,Shirts One Tree Hill  Jersey,['Sport Type:Basketball']
Kawasaki Custom Mens Ice Hockey Jersey Top Wolverines  75# V Neck With Rope Softy Sports Practice Hockey Jerseys Shirts,Shirts,Shirts,"['Sport Type:Ice Hockey', 'Fabric Type:Jersey']"
Kawasaki Custom Men &amp; Women Reversible Basketball Suits Uniforms Breathable Sports Jerseys Shorts Basketball Team Wear ,Shirts,Shirts,"['Sport Type:Basketball', 'Gender:Men']"
INDCOLTS Cheap 11 ED Monix #7 Coffee Black Jersey Flint Tropics Semi Pro Movie Embroidered Basketball White Men Sport Jerseys,Shirts,Shirts,"['Sport Type:Basketball', 'Fabric Type:Jersey', 'Brand Name:INDCOLTS', 'Gender:Men']"
Ediwallen 1996 USA Dream Three 6 Penny Hardaway Basketball Jerseys Cheap Sleeveless Breathable Stitched Navy Blue White Sale,Shirts,Shirts,"['Sport Type:Basketball', 'Fabric Type:Jersey', 'Sleeve Length(cm):Sleeveless', 'Model Number:6']"
ASIAN Size Basketball Jerseys Kyrie Irving &amp; Kevin Durant &amp; LeBron James &amp; Stephen Curry &amp; Kobe Bryant Breathable Sports Shirts,Shirts,Shirts,"['Sport Type:Basketball', 'Model Number:Basketball Jerseys']"
POC Running glasses 3 Lens fast Photochromic Cycling Sunglasses Goggles Men Sport Road Mtb Bike Discoloration Glasses Eyewear,Eyewear,Eyewear,"['Lenses Optical Attribute:Photochromic', 'Model Number:Discoloration', 'Sport Type:Cycling']"
HD Ski Goggles Men Women UV-protection Glasses Anti-fog Cycling Hiking Outdoor Sport Eyewear Snowboard Snowmobile Skiing Goggles,Eyewear,Eyewear,"['Sport Type:Skiing', 'Gender:Men']"
"Stride Rite Baby-Girl's SRT Emilia, White, 6 M US Toddler",Shoes,Shoes Stride Rite SRT Emilia,"['Age:Toddler', ""Gender:Girl's"", 'Color:White', 'Size:6 M US']"
"Flojos Women's Fiesta, Black, 10 M US",Shoes,Shoes Flojos Fiesta,"[""Gender:Women's"", 'Color:Black', 'Size:10 M US']"
"Hush Puppies mens Gil oxfords shoes, Black Leather, 12 Wide US",Shoes,Shoes Hush Puppies Gil oxfords 12 Wide US,"['Gender:mens', 'Color:Black', 'Material:Leather']"
Aravon Women's Jodi,Shoes,Shoes Aravon Jodi,"[""Gender:Women's""]"
"Franco Sarto Women's Nolan, Black, 9.5 N US",Shoes,Shoes 9.5 N US,"['Brand:Franco Sarto', ""Gender:Women's"", 'Model name:Nolan', 'Color:Black']"
"Spenco Women's Supreme Slide Mule, Taupe, 11 M US",Shoes,Shoes Spenco Supreme Slide Mule 11 M US,"[""Gender:Women's"", 'Color:Taupe']"
"Camper Men's Pelotas XL 18304, Dark Brown, 41 EU/8 M US",Shoes,Shoes Camper Pelotas XL 18304 Dark Brown 41 EU/8 M US,"[""Gender:Men's""]"
"Deer Stags Men's Tribune Wingtip Oxford,Black,14 M",Shoes,Shoes Deer Stags Tribune Wingtip 14 M,"[""Gender:Men's"", 'Shoe type:Oxford', 'Color:Black']"
Walking Cradles Women's Natalie Classic Slide,Shoes,Shoes Walking Cradles Natalie Classic Slide,"[""Gender:Women's""]"
Pearl Izumi Men's X-Alp Low Shoe-49-Black/Moonlight,Shoes,Shoes Pearl Izumi X-Alp Low 49 Black/Moonlight,"[""Gender:Men's""]"
"Ellie Shoes Women's 8401, Black, 5 M US",Shoes,Shoes 8401,"['Brand:Ellie Shoes', ""Gender:Women's"", 'Color:Black', 'Size:5 M US']"
"Crocs Women's Jayna Ballet Flat,Nautical Navy,4 M US",Shoes,Shoes Jayna Nautical Navy 4 M US,"['Brand:Crocs', ""Gender:Women's"", 'Shoe type:Ballet Flat']"
"Saucony Women's Kinvara 11, Aqu/Blu, 9 Wide",Shoes,Shoes Saucony Kinvara 11 Aqu/Blu 9 Wide,"[""Gender:Women's""]"
"Diesel Men's Loop Nylon, Brown, 10 M US",Shoes,Shoes Loop Nylon,"['Brand:Diesel', ""Gender:Men's"", 'Color:Brown', 'Size:10 M US']"
"Dockers Men's Castaway Boat Shoe,Raisin,14 W US",Shoes,Shoes Dockers Castaway Boat Shoe Raisin 14 W US,"[""Gender:Men's""]"
Tamarac by Slippers International Men's Handsewn Suede Leather 10 D(M) US Black-Suede,Shoes,Shoes Tamarac by Slippers International Handsewn 10 D(M) US Black-Suede,"[""Gender:Men's"", 'Material:Leather']"
"ROPER Men's Performance Slip On-m, Bay Brown, 10",Shoes,Shoes ROPER Performance Slip On-m Bay Brown,"[""Gender:Men's"", 'Size:10']"
"Volatile Women's Cash Sneaker,White,7 M US",Shoes,Shoes Volatile 7 M US,"[""Gender:Women's"", 'Model name:Cash', 'Shoe type:Sneaker']"
"Kenneth Cole REACTION Men's Punchual Slip On Loafer, Whiskey, 9.5",Shoes,Shoes Kenneth Cole REACTION Punchual Slip On Loafer Whiskey 9.5,"[""Gender:Men's""]"
Pleaser Women's Domina-460,Shoes,Shoes Pleaser Domina-460,"[""Gender:Women's""]"
"Dr. Martens Women's 1B60 20-Eye Boot,Black,7 UK (US Women's 9 M)",Shoes,Shoes Dr. Martens 1B60 20-Eye Boot US Women's 9 M,"[""Gender:Women's"", 'Color:Black']"
"Dockers Men's Catalina Slip-On,Saddle Tan,12 M US",Shoes,Shoes Dockers Catalina Saddle Tan 12 M US,"[""Gender:Men's"", 'Shoe type:Slip-On']"
"Diesel Men's Eagle Loop Leather Fashion Sneaker,Blue,10.5 M US",Shoes,Shoes Eagle Loop,"['Brand:Diesel', ""Gender:Men's"", 'Material:Leather', 'Shoe type:Fashion Sneaker', 'Color:Blue', 'Size:10.5 M US']"
"Stacy Adams Men's Madison Oxford,Blue,12 D US",Shoes,Shoes 12 D US,"['Brand:Stacy Adams', ""Gender:Men's"", 'Model name:Madison', 'Shoe type:Oxford', 'Color:Blue']"
G.H. Bass & Co. Women's Margie Sandal,Shoes,Shoes G.H. Bass & Co. Margie,"[""Gender:Women's"", 'Shoe type:Sandal']"
"Trotters Women's Lauren Dress Wedge,Black,7 N US",Shoes,Shoes Trotters Lauren Dress Wedge 7 N US,"[""Gender:Women's"", 'Color:Black']"
New Balance Men's M587 Running Shoe,Shoes,Shoes New Balance M587,"[""Gender:Men's"", 'Sport:Running']"
Easy Street Women's Drape Toast Slingback,Shoes,Shoes Easy Street Drape Toast Slingback,"[""Gender:Women's""]"
Miz Mooz Women's Panthea,Shoes,Shoes Miz Mooz Panthea,"[""Gender:Women's""]"
Rockport Men's World Tour Classic Walking Shoe Chocolate Nubuck 7 W,Shoes,Shoes Rockport Chocolate Nubuck 7 W,"[""Gender:Men's"", 'Model name:Classic', 'Sport:Walking']"
Donald J Pliner Womens Honey -26 Closed Toe Loafers Black,Shoes,Shoes Donald J Pliner Honey -26 Closed Toe Loafers,"['Gender:Womens', 'Color:Black']"
Finn Comfort Women's Adana,Shoes,Shoes Finn Comfort Adana,"[""Gender:Women's""]"
"Osiris Men's Duffel LP Skateboarding Shoe,Blue/White/Black,10.5 M US",Shoes,Shoes Osiris Duffel LP Blue/White/Black,"[""Gender:Men's"", 'Sport:Skateboarding', 'Size:10.5 M US']"
"Crocs Men's 11989M Clog,Black/Black,4 M US",Shoes,Shoes 11989M Clog Black/Black 4 M US,"['Brand:Crocs', ""Gender:Men's""]"
Nike Dunk High,Shoes,Shoes Dunk High,['Brand:Nike']
"Diesel Men's Pass On, Black/Silver, 7 M US",Shoes,Shoes Black/Silver,"['Brand:Diesel', ""Gender:Men's"", 'Model name:Pass On', 'Size:7 M US']"
CL by Chinese Laundry Women's Sonnet Vitello Pump,Shoes,Shoes CL by Chinese Laundry Sonnet Vitello,"[""Gender:Women's"", 'Shoe type:Pump']"
"Robeez Mini Shoez Scalloped Pop Flower Mary Jane (Infant/Toddler),Brown/Pink,3-6 Months (2 M US Infant)",Shoes,Shoes Robeez Mini Shoez Scalloped Pop Flower Mary Jane Brown/Pink 2 M US Infant,['Age:3-6 Months']
Vans Classic Slip-On (Tod/YTH) - (ASPCA) Dogs-3.5 M YTH,Shoes,Shoes Vans (ASPCA) Dogs 3.5 M YTH,"['Model name:Classic', 'Shoe type:Slip-On', 'Age:Tod/YTH']"
Minnetonka Men's Double Bottom Hardsole,Shoes,Shoes Double Bottom Hardsole,"['Brand:Minnetonka', ""Gender:Men's""]"
"Hush Puppies Men's Mall Walker Oxford,Black Leather,10 M US",Shoes,Shoes Hush Puppies Mall Walker,"[""Gender:Men's"", 'Shoe type:Oxford', 'Color:Black', 'Material:Leather', 'Size:10 M US']"
Rockport Men's Shakespeare Circle Penny Loafer,Shoes,Shoes Rockport Shakespeare Circle Penny Loafer,"[""Gender:Men's""]"
"L.B. Evans Men's Chicopee Slipper,Tan,12 M",Shoes,Shoes L.B. Evans Chicopee Slipper Tan 12 M,"[""Gender:Men's""]"
"Klogs USA Women's, Dusty Black",Shoes,Shoes Klogs USA Dusty Black,"[""Gender:Women's""]"
Naturalizer Women's Deino Pump,Shoes,Shoes Naturalizer Deino,"[""Gender:Women's"", 'Shoe type:Pump']"
"Birkenstock Professional Unisex Profi Birki Slip Resistant Work Shoe,Blue,41 M EU",Shoes,Shoes Birkenstock Slip Resistant Work Shoe Profi Birki 41 M EU,"['Gender:Unisex', 'Color:Blue']"
"Baby Deer 2154 Crib Shoe (Infant),White/Blue,0.5 M US Infant",Shoes,Shoes Baby Deer 2154 White/Blue 0.5 M US Infant,"['Shoe type:Crib Shoe', 'Age:Infant']"
"Ellie Shoes Men's 105-saddle, Black/White, 10",Shoes,Shoes 105-saddle,"['Brand:Ellie Shoes', ""Gender:Men's"", 'Color:Black/White', 'Size:10']"
New Balance Men's MW811 Walking Shoe,Shoes,Shoes New Balance MW811,"[""Gender:Men's"", 'Sport:Walking']"
Ellie Shoes Neon Stiletto Ankle Strap Platform Sandal Stars 711-STARLA Yellow-9,Shoes,Shoes Yellow-9 Platform Sandal 711-STARLA,"['Brand:Ellie Shoes', 'Closure:Ankle Strap']"
"Ellie Shoes Women's 652-bonnie, Black/Red, 10 M US",Shoes,Shoes 652-bonnie Black/Red,"['Brand:Ellie Shoes', ""Gender:Women's"", 'Size:10 M US']"
"Minnetonka Men's Moosehide Classic, Black, 7 M US",Shoes,Shoes,"['Brand:Minnetonka', ""Gender:Men's"", 'Material:Moosehide', 'Model name:Classic', 'Color:Black', 'Size:7 M US']"
"J-41 Women's Tahoe, Black/Blue, 8.5 M US",Shoes,Shoes J-41 Tahoe Black/Blue,"[""Gender:Women's"", 'Size:8.5 M US']"
"Timberland Men's Radler Trail Camper Oxford,Lime,15 M US",Shoes,Shoes Timberland Radler Trail Camper Lime 15 M US,"[""Gender:Men's"", 'Shoe type:Oxford']"
"Diesel Men's Pass On Lace Up,Buttercup/Black,8.5 M US",Shoes,Shoes Buttercup/Black,"['Brand:Diesel', ""Gender:Men's"", 'Model name:Pass On', 'Closure:Lace Up', 'Size:8.5 M US']"
Florsheim Men's Castellano Wingtip Oxford,Shoes,Shoes Florsheim Castellano Wingtip,"[""Gender:Men's"", 'Shoe type:Oxford']"
"Jessica Simpson Women's Calie Pump,Black Patent,8 M US",Shoes,Shoes Jessica Simpson Calie,"[""Age:Women's"", 'Shoe type:Pump', 'Color:Black Patent', 'Size:8 M US']"
Sandro Moscoloni Men's Tampa Black Venetian Loafer,Shoes,Shoes Sandro Moscoloni Tampa Venetian Loafer,"[""Gender:Men's"", 'Color:Black']"
Mephisto Men's Hurrikan Moccasin,Shoes,Shoes Mephisto Hurrikan,"[""Gender:Men's"", 'Shoe type:Moccasin']"
"Birkenstock Professional Women's Tokyo Super Grip Leather, Black, 5-5.5 Narrow",Shoes,Shoes Birkenstock Professional 5-5.5 Narrow,"[""Gender:Women's"", 'Material:Tokyo Super Grip Leather', 'Color:Black']"
Diesel Men's Exposure High-Top Sneaker,Shoes,Shoes Exposure High-Top Sneaker,"['Brand:Diesel', ""Gender:Men's""]"
"Dr. Martens Women's 1461 W Oxford,Black Patent,6 UK/8 M US",Shoes,Shoes Dr. Martens 1461 W 6 UK/8 M US,"[""Gender:Women's"", 'Shoe type:Oxford', 'Color:Black Patent']"
"Stacy Adams Men's Raynor Oxford,Black,7.5 M US",Shoes,Shoes,"['Brand:Stacy Adams', ""Gender:Men's"", 'Model name:Raynor', 'Shoe type:Oxford', 'Color:Black', 'Size:7.5 M US']"
"Fila Men's Original Tennis-M, Cream/Navy, 6.5 M US",Shoes,Shoes Cream/Navy 6.5 M US,"['Brand:Fila', ""Gender:Men's"", 'Model name:Original', 'Sport:Tennis']"
Nike Women's Air Huarache Run Running Shoe Sunset/Gold Dart/White/Black 6.5,Shoes,Shoes Air Huarache Run Sunset/Gold Dart/White/Black 6.5,"['Brand:Nike', ""Gender:Women's"", 'Sport:Running']"
"Florsheim Men's Milano Slip-On Loafer,Burgundy,10 D US",Shoes,Shoes Florsheim Milano Burgundy 10 D US,"[""Gender:Men's"", 'Shoe type:Slip-On Loafer']"
The Highest Heel Women's Kissable Pump,Shoes,Shoes The Highest Heel Kissable,"[""Gender:Women's"", 'Shoe type:Pump']"
Northside Men's Lincoln Waterproof Rubber Boot,Shoes,Shoes Northside Lincoln Boot,"[""Gender:Men's"", 'Waterproof:Waterproof', 'Material:Rubber']"
"Stacy Adams Men's Madison Cap-Toe Spat Boot,Brown Multi,13 D US",Shoes,Shoes Cap-Toe Spat Boot Brown Multi 13 D US,"['Brand:Stacy Adams', ""Gender:Men's"", 'Model name:Madison']"
"Gentle Souls by Kenneth Cole Women's Bay Braid Ballet Flat, Antique Pewter, 10 M US",Shoes,Shoes Gentle Souls by Kenneth Cole Antique Pewter,"[""Gender:Women's"", 'Model name:Bay Braid', 'Shoe type:Ballet Flat', 'Size:10 M US']"
"Stacy Adams Men's Madison Oxford,Black Snakeskin,11 D US",Shoes,Shoes 11 D US,"['Brand:Stacy Adams', ""Gender:Men's"", 'Model name:Madison', 'Shoe type:Oxford', 'Color:Black', 'Material:Snakeskin']"
"Minnetonka Women's Kilty Unbeaded Moccasin,Navy Smooth,7.5 M US",Shoes,Shoes Kilty Unbeaded Navy Smooth,"['Brand:Minnetonka', ""Gender:Women's"", 'Shoe type:Moccasin', 'Size:7.5 M US']"
"Dunham Men's Blair Slip-On,Brown Smooth,10 4E US",Shoes,Shoes Blair Brown Smooth 10 4E US,"['Brand:Dunham', ""Gender:Men's"", 'Shoe type:Slip-On']"
"Anne Klein Women's Fabulist Leather, Black, 7.5 M US",Shoes,Shoes Anne Klein Fabulist,"[""Gender:Women's"", 'Material:Leather', 'Color:Black', 'Size:7.5 M US']"
"Rockport Women's World Tour Classic Walking Shoe,Chocolate,5 M US",Shoes,Shoes Rockport World Tour Classic,"[""Gender:Women's"", 'Sport:Walking', 'Color:Chocolate', 'Size:5 M US']"
"Polo Ralph Lauren Men's Conrad Canvas Hi-Top Sneaker,FAL Roy/Ru,10.5 D US",Shoes,Shoes Polo Ralph Lauren Conrad Hi-Top Sneaker FAL Roy/Ru 10.5 D US,"[""Gender:Men's"", 'Material:Canvas']"
"Gentle Souls by Kenneth Cole Women's Bay Braid Ballet Flat, Black Leather, 9 M US",Shoes,Shoes Gentle Souls by Kenneth Cole 9 M US,"[""Gender:Women's"", 'Model name:Bay Braid', 'Shoe type:Ballet Flat', 'Color:Black', 'Material:Leather']"
"Onex Women's Christina Sandal,Brown Leopard,6 M US",Shoes,Shoes Brown Leopard,"['Brand:Onex', ""Gender:Women's"", 'Model name:Christina', 'Shoe type:Sandal', 'Size:6 M US']"
Sebago Women's Bala Slip-On Loafer,Shoes,Shoes Sebago Bala,"[""Gender:Women's"", 'Shoe type:Slip-On Loafer']"
"Volatile Women's Cash Sneaker,White,7.5 M US",Shoes,Shoes Volatile,"[""Gender:Women's"", 'Model name:Cash', 'Shoe type:Sneaker', 'Color:White', 'Size:7.5 M US']"
"Spring Step Women's Chino,Brown,35 EU/4.5-5 M US",Shoes,Shoes Spring Step Chino 35 EU/4.5-5 M US,"[""Gender:Women's"", 'Color:Brown']"
Cole Haan Men's Gunnison DriverBrown9 D US,Shoes,Shoes Cole Haan Gunnison Driver 9 D US,"[""Gender:Men's"", 'Color:Brown']"
"Diesel Men's Runaway Fashion Sneaker,White,11 M US",Shoes,Shoes Runaway 11 M US,"['Brand:Diesel', ""Gender:Men's"", 'Shoe type:Fashion Sneaker', 'Color:White']"
"SJP by Sarah Jessica Parker Women's Fawn Pointed Toe Dress Pump, Candy, 6.5 Medium US",Shoes,Shoes SJP by Sarah Jessica Parker Fawn Pointed Toe Dress Pump Candy 6.5 Medium US,"[""Gender:Women's""]"
"The Highest Heel womens Classic 4"" Pump, Gold Metallic, 6 US",Shoes,"Shoes The Highest Heel 4"" Pump, Gold Metallic 6 US","['Gender:womens', 'Model name:Classic']"
Finn Comfort Women's 2051-014099,Shoes,Shoes Finn Comfort 2051-014099,"[""Gender:Women's""]"
Drew Shoe Women's Dora,Shoes,Shoes Drew Shoe Dora,"[""Gender:Women's""]"
"Stacy Adams Men's Templin Bicycle-Toe Slip-On,Cognac,10.5 M",Shoes,Shoes Templin Bicycle-Toe Slip-On Cognac 10.5 M,"['Brand:Stacy Adams', ""Gender:Men's""]"
"Skechers Women's Parties-Mate Oxford,Chocolate Suede Leather,5.5 M US",Shoes,Shoes Skechers Parties-Mate 5.5 M US,"[""Gender:Women's"", 'Shoe type:Oxford', 'Color:Chocolate', 'Material:Suede Leather']"
"Ellie Shoes Women's 557-eden, Black, 12 M US",Shoes,Shoes 557-eden 12 M US,"['Brand:Ellie Shoes', ""Gender:Women's"", 'Color:Black']"
"Foamtreads Women's CODDELSN, Mauve, 8.5 B US",Shoes,Shoes Foamtreads CODDELSN Mauve 8.5 B US,"[""Gender:Women's""]"
"Saucony Originals Men's Sneaker, Mint/Green, 9.5 M US",Shoes,Shoes Saucony Originals Mint/Green,"['Gender:Sneaker', 'Size:9.5 M US']"
"Ralph Lauren Layette Bal Harbour Crib Shoe (Infant/Toddler),Navy,0 M US Infant",Shoes,Shoes Ralph Lauren Layette Bal Harbour 0 M US Infant,"['Shoe type:Crib Shoe', 'Age:Infant/Toddler', 'Color:Navy']"
"Onex Women's Infinity Thong,Black,5 M US",Shoes,Shoes Infinity Thong,"['Brand:Onex', ""Gender:Women's"", 'Color:Black', 'Size:5 M US']"
"Sperry Women's Angelfish-W, Black, 8 M US",Shoes,Shoes Sperry Angelfish-W,"[""Gender:Women's"", 'Color:Black', 'Size:8 M US']"
"La Plume Women's Paola, Ivory, 36 (5.5-6 Women's B US)",Shoes,Shoes La Plume Paola Ivory 36 (5.5-6 Women's B US),"[""Gender:Women's""]"
"Minnetonka Men's Moosehide Classic Moccasin,Chocolate Moose,8.5 M US",Shoes,Shoes Chocolate Moose,"['Brand:Minnetonka', ""Gender:Men's"", 'Material:Moosehide', 'Model name:Classic', 'Shoe type:Moccasin', 'Size:8.5 M US']"
"Klogs USA Women's Dusty, Gloss Black, 11 W US",Shoes,Shoes Klogs USA Dusty Gloss Black 11 W US,"[""Gender:Women's""]"
"Fila Men's Hometown Extra-M, Black/White/Vintage Red, 10 M US",Shoes,Shoes Hometown Extra-M Black/White/Vintage Red,"['Brand:Fila', ""Gender:Men's"", 'Size:10 M US']"
"EMU Australia Women's Stinger Lo, Mushroom, 10 M US",Shoes,Shoes EMU Australia Stinger Lo Mushroom,"[""Gender:Women's"", 'Size:10 M US']"
Stacy Adams Men's Raynor Oxford,Shoes,Shoes,"['Brand:Stacy Adams', ""Gender:Men's"", 'Model name:Raynor', 'Shoe type:Oxford']"
"Crocs Women's Kadee Flat,Raspberry/Raspberry,6 M US",Shoes,Shoes Kadee Flat Raspberry/Raspberry,"['Brand:Crocs', ""Gender:Women's"", 'Size:6 M US']"
"Minnetonka Men's Moosehide Classic Moccasin,Natural Moose,10.5 M US",Shoes,Shoes Classic Moccasin Natural Moose,"['Brand:Minnetonka', ""Gender:Men's"", 'Material:Moosehide', 'Size:10.5 M US']"
"Minnetonka Women's Deerskin Gore Front Moccasin,Mocha Deerskin,7 M US",Shoes,Shoes Gore Front Moccasin Mocha Deerskin,"['Brand:Minnetonka', ""Gender:Women's"", 'Material:Deerskin', 'Size:7 M US']"
Sanuk Shuffle,Shoes,Shoes Sanuk Shuffle,[]
"Minnetonka Women's Deerskin Soft-T Moccasin,Champagne Deerskin,8 M US",Shoes,Shoes,"['Brand:Minnetonka', ""Gender:Women's"", 'Material:Deerskin', 'Model name:Soft-T', 'Shoe type:Moccasin', 'Color:Champagne Deerskin', 'Size:8 M US']"
"Eastland Women's Syracuse, Black, 7 M US",Shoes,Shoes Eastland Syracuse,"[""Gender:Women's"", 'Color:Black', 'Size:7 M US']"
"Dunham Men's Battery Park Slip On,Black,8 D US",Shoes,Shoes Battery Park Slip On 8 D US,"['Brand:Dunham', ""Gender:Men's"", 'Color:Black']"
"Minnetonka Women's Deerskin Soft-T Moccasin,Champagne Deerskin,5 M US",Shoes,Shoes Soft-T Moccasin,"['Brand:Minnetonka', ""Gender:Women's"", 'Material:Deerskin', 'Color:Champagne Deerskin', 'Size:5 M US']"
Nike Men's Wild Trail Black/Cool Grey/Dark Grey/Metallic Platinum 11.5 D - Medium,Shoes,Shoes Wild Trail Black/Cool Grey/Dark Grey/Metallic Platinum 11.5 D - Medium,"['Brand:Nike', ""Gender:Men's""]"
"Onex Women's Sail Sandal,Black,9 M US",Shoes,Shoes Sail 9 M US,"['Brand:Onex', ""Gender:Women's"", 'Shoe type:Sandal', 'Color:Black']"
"Polo Ralph Lauren Men's Vaughn, Dark Khaki, 12 D US",Shoes,Shoes Polo Ralph Lauren Vaughn Dark Khaki 12 D US,"[""Gender:Men's""]"
"Fila Men's Original Tennis-M, Cream/E.Navy, 11 M US",Shoes,Shoes Cream/E.Navy 11 M US,"['Brand:Fila', ""Gender:Men's"", 'Model name:Original', 'Sport:Tennis']"
Earth Shoes Bali,Shoes,Shoes Earth Bali,[]
"Georgia Men's G6152 Mid Calf Boot, barracuda gold, 13 M US",Shoes,Shoes Georgia G6152 Mid Calf Boot barracuda gold 13 M US,"[""Gender:Men's""]"
"La Plume Women's Jen, Beige Python, 36 (US Women's 5.5-6)",Shoes,Shoes La Plume Jen Beige Python 36 (US Women's 5.5-6),"[""Gender:Women's""]"
"Dr. Scholl's Shoes Women's Jam Session Sneaker, Soft Grey Snake, 7.5",Shoes,Shoes Dr. Scholl's Shoes Jam Session Soft Grey Snake 7.5,"[""Gender:Women's"", 'Shoe type:Sneaker']"
Michael Michael Kors MK Flex Kitten Pump Black Patent 8,Shoes,Shoes Michael Michael Kors MK Flex Kitten 8,"['Shoe type:Pump', 'Color:Black Patent']"
"Keds Women's Bryn Ballet Flat, Breton Stripe, 5",Shoes,Shoes Keds Bryn Breton Stripe 5,"[""Gender:Women's"", 'Shoe type:Ballet Flat']"
"Cole Haan Men's Howland Penny, T.Moro Crocodile, 8 M US",Shoes,"Shoes Cole Haan Howland Penny, T.Moro Crocodile","[""Gender:Men's"", 'Size:8 M US']"
Sanuk Chiba Black 10,Shoes,Shoes Sanuk Chiba,"['Color:Black', 'Size:10']"
"T.U.K. Unisex A8140 Creeper Oxford,Black/White,5 M US",Shoes,Shoes T.U.K. A8140 Creeper Oxford,"['Gender:Unisex', 'Color:Black/White', 'Size:5 M US']"
Diesel Men's Great Era-Pass On-00YC11PS048 Sneaker,Shoes,Shoes Great Era-Pass On-00YC11PS048,"['Brand:Diesel', ""Gender:Men's"", 'Shoe type:Sneaker']"
"Minnetonka Women's Deerskin Soft-T Moccasin,Champagne Deerskin,7.5 M US",Shoes,Shoes,"['Brand:Minnetonka', ""Gender:Women's"", 'Material:Deerskin', 'Model name:Soft-T', 'Shoe type:Moccasin', 'Color:Champagne Deerskin', 'Size:7.5 M US']"
"Dunham Men's 8500, Brown, 13 4E US",Shoes,Shoes 8500 13 4E US,"['Brand:Dunham', ""Gender:Men's"", 'Color:Brown']"
"Ellie Women's 601-juliet, White, 5 M US",Shoes,Shoes Ellie 601-juliet,"[""Gender:Women's"", 'Color:White', 'Size:5 M US']"
Yellow Box Women's Gabbie,Shoes,Shoes Yellow Box Gabbie,"[""Gender:Women's""]"
"Yellow Box womens Shelly-s sandals, Pewter, 6 US",Shoes,Shoes Yellow Box Shelly-s sandals Pewter 6 US,['Gender:womens']
"Minnetonka Men's Nub Sole Moccasin,Black,11.5 M US",Shoes,Shoes Nub Sole 11.5 M US,"['Brand:Minnetonka', ""Gender:Men's"", 'Shoe type:Moccasin', 'Color:Black']"
"Nike Golf Men's Nike Heritage-M, White/Metallic Silver/Black, 13 W US",Shoes,Shoes Heritage-M White/Metallic Silver/Black 13 W US,"['Brand:Nike', 'Sport:Golf', ""Gender:Men's""]"
"Ellie Shoes Women's 8400, Red Patent, 14 M US",Shoes,Shoes 8400 Red Patent 14 M US,"['Brand:Ellie Shoes', ""Gender:Women's""]"
"STACY ADAMS Men's Corrado Bike Toe Lace-up Oxford, Cognac, 14",Shoes,Shoes STACY ADAMS Corrado 14,"[""Gender:Men's"", 'Shoe type:Oxford', 'Closure:Lace-up']"
Hush Puppies womens Epic Mary Jane Black 9.5 M US,Shoes,Shoes Hush Puppies Epic Mary Jane,"['Gender:womens', 'Color:Black', 'Size:9.5 M US']"
"Eastland Men's Buck,Taupe Suede,10.5 2E US",Shoes,Shoes Eastland Buck 10.5 2E US,"[""Gender:Men's"", 'Color:Taupe', 'Material:Suede']"
"Calvin Klein Men's Merl Suede, Navy, 9.5 M US",Shoes,Shoes Calvin Klein Merl Suede,"[""Gender:Men's"", 'Color:Navy', 'Size:9.5 M US']"
"Franco Sarto Women's Bocca Loafer,Black,10.5 M",Shoes,Shoes Bocca Loafer 10.5 M,"['Brand:Franco Sarto', ""Gender:Women's"", 'Color:Black']"
Holy Land Market Unisex Leather Biblical Sandals (Jesus - Yashua) Jerusalem Style II Brown,Shoes,Shoes Holy Land Market Biblical Sandals Jerusalem Style II,"['Gender:Unisex', 'Material:Leather', 'Color:Brown']"
Osiris Men's Lennix-M,Shoes,Shoes Osiris Lennix-M,"[""Gender:Men's""]"
Naturalizer Women's Music,Shoes,Shoes Naturalizer Music,"[""Gender:Women's""]"
TOMS Womens Classics Black Canvas 001001B07-BLK Womens 5,Shoes,Shoes TOMS 001001B07-BLK 5,"['Gender:Womens', 'Color:Black', 'Material:Canvas']"
"Franco Sarto Women's Nolan, Black, 10 W US",Shoes,Shoes 10 W US,"['Brand:Franco Sarto', ""Gender:Women's"", 'Model name:Nolan', 'Color:Black']"
"Gain flings! Laundry Detergent Soap Pacs, High Efficiency (HE), Original Scent, 96 Count",Laundry Detergent,Laundry Detergent Gain flings! High Efficiency (HE) 96 Count,"['Item form:Pacs', 'Scent:Original Scent']"
"Persil ProClean Power-Liquid Laundry Detergent, Intense Fresh, 150 Fluid Ounces, 96 Loads",Laundry Detergent,Laundry Detergent,"['Brand:Persil', 'Specialty:ProClean', 'Item form:Power-Liquid', 'Scent:Intense Fresh', 'Net content:150 Fluid Ounces', 'Load size:96 Loads']"
"Persil Liquid Laundry Detergent, ProClean Scent, 2X Concentrated, 110 Loads, Blue, 82.5 Fl Oz, Original",Laundry Detergent,Laundry Detergent 82.5 Fl Oz,"['Brand:Persil', 'Item form:Liquid', 'Scent:Original', 'Specialty:2X Concentrated', 'Load size:110 Loads', 'Color:Blue']"
"OxiClean Dark Protect Liquid Laundry Additive, 50 oz.",Laundry Detergent,Laundry Detergent Dark Protect Additive 50 oz,"['Brand:OxiClean', 'Item form:Liquid']"
"Persil ProClean Liquid Laundry Detergent, Original, 100 Fluid Ounces, 64 Loads",Laundry Detergent,Laundry Detergent 100 Fluid Ounces,"['Brand:Persil', 'Specialty:ProClean', 'Item form:Liquid', 'Scent:Original', 'Load size:64 Loads']"
Tyler Candle Company Tyler Candle Co Kathina Glamorous Wash Kathina,Laundry Detergent,Laundry Detergent Glamorous Wash,[]
