input,category,context,filter
2018 LeBron Lakers New Elastic Pocket Basketball Jersey Basket Sportswear Loose Sport Men&#39;s Shorts Tennis Men Basketball Shorts,Shorts,Shorts,"['Sport Type:Basketball', 'Gender:Men']"
PEAK Men&#39;s Breathable Running Shorts Comfortable Woven Short for Gym Jogging Training Outdoor Sports,Shorts,Shorts,"['Sport Type:Running', 'Brand Name:PEAK', 'Gender:Men']"
Yoga Shorts Women Sport Fitness 2 In 1 Women Athletic Shorts Cool Ladies Fake Two Pieces Running Short Fitness Clothes Jogging,Shorts,Shorts,"['Sport Type:Running', 'Gender:Women']"
Li-Ning 2018 Women Running Shorts Quick Dry Polyester Breathable Regular Fit Li Ning Comfortable Sports Shorts AKSN138,Shorts,Shorts AKSN138,"['Sport Type:Running', 'Gender:Women']"
2018 New Women Marathon Running Shorts Quick Dry Training Crossfit Fitness Gym Sports Shorts W1,Shorts,Shorts,"['Sport Type:Running', 'Gender:Women']"
Men Women Running Shorts Sports Basketball Football Training Shorts Beach Board Joggers Fitness Gym Clothes Breathable Quick Dry,Shorts,Shorts,"['Sport Type:Running', 'Gender:Men']"
GOSOUER Women Sexy Running Compression Shorts Gym Cool Female Push Up Sport Shorts Fitness Shorts Quick Dry Sportswear Shorts,Shorts,Shorts GOSOUER,"['Sport Type:Running', 'Gender:Women']"
Colorful Galaxy Shorts Women Beach Jogging Short Pant Purple Bright Star Fitness Sports Running Shorts Pantaloncini Da Donna 4XL,Shorts,Shorts,"['Gender:Women', 'Sport Type:Running', 'Color:Colorful']"
Men Summer Slim Shorts Gym Fitness Bodybuilding Running Jogging Training Male Short Pant Knee Length Breathable Mesh Sportswear,Shorts,Shorts,"['Gender:Men', 'Sport Type:Running']"
Women Cotton Fitness Sports Shorts Elastic Waist Running Summer  Size Loose Ladies Leisure Shorts In Stock,Shorts,Shorts,"['Sport Type:Running', 'Gender:Women', 'Material:Cotton']"
2018 Mens Sports Running Shorts Active Training Exercise Gym Jogging Shorts With Liner Loose Basketball Shorts Plus Size S,Shorts,Shorts,"['Sport Type:Running', 'Model Number:0', 'Gender:Men']"
"F plus R Men&#39;s Mesh Breathable Shorts,Men&#39;s Surfing Board Shorts,Men&#39;s Swimming Running Sports Shorts",Shorts,Shorts,"['Sport Type:Running', 'Gender:Men', 'Brand Name:F plus R']"
FRECICI Women Cycling Running Workout Tights Yoga Shorts Half Tights with Pockets High Waist Tummy Contral Pocket Sports Shorts ,Shorts,Shorts FRECICI,"['Sport Type:Running', 'Gender:Women']"
Vansydical Fitness Running Shorts Men&#39;s Printed Elastic Compression Shorts Quick Dry Workout Jogging Gym Sports Shorts ,Shorts,Shorts,"['Sport Type:Running', 'Gender:Men']"
Original New Arrival 2018 Adidas NEO Label CE 3/4 TP Men&#39;s Shorts Sportswear ,Shorts,Shorts,"['Brand Name:Adidas', 'Gender:Men']"
Men&#39;s Breathable Running Shorts Quick Dry Summer Comfort Running Shorts Sport Shorts 3 Colors,Shorts,Shorts,"['Sport Type:Running', 'Gender:Men']"
PENERAN Fitness Gym Shorts Men Running Jogging Shorts Man Sport Short Bandage Camouflage Athletic Sport Wear Dry Fit 2018 M 3XL,Shorts,Shorts,"['Gender:Men', 'Brand Name:PENERAN', 'Sport Type:Running']"
Vintage Eye Of Providence Shorts Women Fitness Gym Running Shorts Green Egyptian Pyramids Sport Jogging Shorts Pantalones Cortos,Shorts,Shorts,"['Gender:Women', 'Sport Type:Running']"
Men&#39;s Running Wide Crotch Harem Shorts Loose Summer Large Cropped Trousers Wide-legged Bloomers Flaxen Baggy Shorts,Shorts,Shorts,"['Sport Type:Running', 'Gender:Men']"
PARGO Men Sports Running Shorts Pants Gym Training Shorts Jogging Sports Fitness Bodybuilding Sweatpants Male Workout Crossfit,Shorts,Shorts PARGO,"['Sport Type:Running', 'Gender:Men']"
New Men Gym Clothing Compression Soccer Running Shorts Sports Fitness Basketball Tights short Leggings Spandex Elastic Quick Dry,Shorts,Shorts,"['Sport Type:Running', 'Gender:Men']"
Purple Abstract Retro Running Shorts Women Gym Panties Abstract Print Sports Short Pant Summer Beachwear Shorts Pantaloncini 4XL,Shorts,Shorts,"['Gender:Women', 'Sport Type:Running']"
Number 23 Basketball Shorts Quick Dry Plus Size Training Sports Shorts Running Fitness GYM Pockets Shorts,Shorts,Shorts,['Sport Type:Basketball']
Women Shorts Quick Dry Summer Women Board Surf Swimwear Beach Short For Women Athletic Running Gym Shorts,Shorts,Shorts,"['Sport Type:Running', 'Gender:Women']"
2018 Running Shorts Men Cotton Compression Tight Sport Training Shorts Sportswear Crossfit Short Pants Fitness GYM Shorts Male,Shorts,Shorts,"['Sport Type:Running', 'Gender:Men']"
Summer Men Training Basketball Shorts Breathable Mesh Women Running Sports Jerseys,Shorts,Shorts,"['Sport Type:Basketball', 'Fabric Type:Jersey', 'Gender:Men']"
2017 Summer Women Sports Yoga Shorts Gym Workout Waistband Skinny Yoga Short#XTJ,Shorts,Shorts,['Gender:Women']
2018 New Basketball Shorts For Men Outdoor Sports Fitness Short Pants Quick-dry Breathable Running Training Loose Shorts 3XL,Shorts,Shorts,"['Sport Type:Basketball', 'Gender:Men']"
New Running Sport Mens Basketball Tight Compression Shorts Gym Fitness Clothing Training Wicking (Red black and white point ),Shorts,Shorts,"['Gender:Men', 'Sport Type:Running']"
 Tennis Workout Shorts Men Training Soccer Quick Dry Outdoor Jogging Elastic Shorts Basketball Fitness Running 2018 New Shorts,Shorts,Shorts,"['Sport Type:Basketball', 'Gender:Men']"
2018 New Running Shorts Men Basketball Gym Sport Short Pants Athletic Tennis Volleyball Crossfit Trianing cceSor Football sport,Shorts,Shorts,"['Sport Type:Running', 'Gender:Men']"
Men Compression Running Shorts Mesh Breathable Training Fitness Tight Shorts Boys Elastic Quick Dry Basketball Sports Shorts,Shorts,Shorts,"['Sport Type:Running', 'Gender:Men']"
Original New Arrival 2018 Adidas M ID Stadium Sh Men&#39;s Shorts Sportswear,Shorts,Shorts,"['Gender:Men', 'Brand Name:Adidas']"
2018 Men&#39;s Basketball Shorts Loose Leisure Beach Shorts Letter Gym Training Sport Short Trousers Men&#39;s Quick Dry Running Shorts,Shorts,Shorts,"['Sport Type:Basketball', 'Gender:Men']"
WANAYOU Double Layer Fitness Shorts Women Knitting&amp;Elasticity Running Shorts Outdoor Summer Sport Female Athletic Jogging Shorts,Shorts,Shorts WANAYOU,"['Sport Type:Running', 'Gender:Women']"
ZEROBIKE 2018 High Quality Women&#39;s Cycling Shorts 4D Gel Padded Breathable Shockproof MTB Bike Wear Bicycle Short Pants Ciclismo,Shorts,Shorts,"['Sport Type:Cycling', 'Gender:Women']"
Brand Running Shorts Men Run Jogging Sports Bodybuilding Sweatpants Fitness Gym Cotton Crossfit Shorts Mens Beach Short Pants,Shorts,Shorts,"['Sport Type:Running', 'Gender:Men']"
2019 Sport Running Shorts Men Summer Outdoor Sports Mens Shorts Homme Bermudas Basketball Short Surf Gym Clothing Boardshorts,Shorts,Shorts,"['Sport Type:Running', 'Gender:Men']"
ARSUXEO Men&#39;s Outdoor Sports 3&quot; Running Shorts Active Training Exercise Reflective Run Shorts with Linner B176,Shorts,Shorts,"['Sport Type:Running', 'Gender:Men', 'Brand Name:ARSUXEO']"
Zipper Elastic Waist Fast Dry Men Running Shorts Sport Cotton Short Trousers Fitness Workout Crossfit Hot Trousers JRDK019,Shorts,Shorts JRDK019,"['Sport Type:Running', 'Gender:Men', 'Material:Cotton']"
Space Jam Tune Squad Men&#39;s Basketball Shorts Stitched White,Shorts,Shorts,"['Sport Type:Basketball', 'Gender:Men']"
Copiro Running Shorts For Men Sports Fitness Breathable High Elastic Perspiration Underwear Quick Drying Panties,Shorts,Shorts Copiro,"['Gender:Men', 'Sport Type:Running', 'Feature:Breathable']"
Leisure Slim Picture Printing Men Shorts Elastic Waist Fitness Running Basketball Short Trousers Men Cotton Sweatpants JRDK016,Shorts,Shorts JRDK016,"['Sport Type:Running', 'Gender:Men', 'Pattern:Print', 'Material:Cotton', 'Style:Leisure']"
Sport Outdoor Slim Leisure Men Shorts Running Basketball Polyester Black Color High Elastic Short Trousers Sweatpants JRDK041,Shorts,Shorts JRDK041,"['Sport Type:Running', 'Gender:Men', 'Material:Polyester', 'Style:Leisure']"
Cotton Running Jogging Shorts Men Beaching Shorts Sports GYM Training Shorts Soft Rashgard Fitness Bodybuilding Short Sweatpants,Shorts,Shorts,"['Sport Type:Running', 'Gender:Men']"
Original New Arrival 2018 Adidas NEO Label CE 3/4 TP Men&#39;s Shorts Sportswear,Shorts,Shorts,"['Brand Name:Adidas', 'Gender:Men']"
Womens Running Shorts 2017 Running Tights Short Women&#39;s Gym Cool Woman Sport Short Fitness Ladies Running Shorts Sportswear,Shorts,Shorts,"['Sport Type:Running', 'Gender:Women']"
New Running Sport Mens Basketball Tight Compression Shorts Gym Fitness Clothing Training Wicking Short Pants,Shorts,Shorts,"['Sport Type:Running', 'Gender:Men']"
Original New Arrival  Adidas SHORT WV LNG Women&#39;s Shorts Sportswear ,Shorts,Shorts,"['Gender:Women', 'Brand Name:Adidas']"
Eye Of Providence Running Shorts Green Egyptian Pyramids Sports Yoga Short Pant Hot Summer Women Beachwear Swimming Shorts S-4XL,Shorts,Shorts,"['Gender:Women', 'Sport Type:Running']"
OHYOUNG 2018 Summer New Mens Plus Size Comfortable Elastic Basketball Shorts Running Training Gym Sport Shorts With Pocket 3XL,Shorts,Shorts,"['Sport Type:Basketball', 'Gender:Men']"
MM MASMIG The Fresh Prince of Bel-Air Academy Basketball Shorts Stitched Black,Shorts,Shorts MM MASMIG,"['Sport Type:Basketball', 'Color:Black']"
Original New Arrival 2018 Adidas ESS LI SHORT Women&#39;s Shorts Sportswear,Shorts,Shorts,"['Brand Name:Adidas', 'Gender:Women']"
Ohyoung Summer Men&#39;s Breathable Running Shorts Black Quick Dry Sportwear Training Fitness Plus Size Run Sports Shorts Size M-5XL,Shorts,Shorts Ohyoung,"['Sport Type:Running', 'Gender:Men']"
ARSUXEO Men&#39;S Fitness Sports Running Shorts Men Fitness Breathable Quick Drying Shorts Outdoor Summer Sports Shorts,Shorts,Shorts,"['Brand Name:ARSUXEO', 'Gender:Men', 'Sport Type:Running']"
2018 New Sport Shorts Men Big Size Up to 8XL Running Short Breathable Quick Dry Gym Outdoor Waterproof Summer Sportswear Fitness,Shorts,Shorts,"['Sport Type:Running', 'Gender:Men']"
100% Cotton Women&#39;s Sports Shorts Denim Fabrics Holes Burrs Loose Hot Shorts Young Girl Outdoor Beach Shorts  Motion Knickers,Shorts,Shorts,"['Gender:Women', 'Material:Cotton']"
ARSUXEO Sports Running Shorts Men Women Training Soccer Tennis GYM Breathable Quick Dry Outdoor Jogging Shorts With Liner,Shorts,Shorts,"['Sport Type:Running', 'Gender:Women', 'Brand Name:ARSUXEO']"
Running Shorts Men Basketball Gym Sport Short Pants L-4XL Athletic Tennis Volleyball Soccer Football Shorts With Pocket,Shorts,Shorts,"['Gender:Men', 'Sport Type:Running']"
Men&#39;s Solid Color Summer Outdoor Sports Shorts With Pockets Running Workout Shorts Outdoor Fitness Casual Shorts,Shorts,Shorts,"['Sport Type:Running', 'Gender:Men', 'Pattern:Solid']"
Men Basketball Shorts Quick-drying Shorts Men Basketball European Size Basketball Short Pantaloncini Elastic Basket Sport Shorts,Shorts,Shorts,"['Sport Type:Basketball', 'Gender:Men']"
Summer Korean Version Burrs High Waist Denim Sports Shorts Women&#39;s Hot Shorts Youth  Beach Shorts 100% Cotton Denim Fabrics,Shorts,Shorts,"['Gender:Women', 'Material:Cotton']"
Professional Basketball Shorts Basketball Sports Jerseys Running Sports Shorts Sportswear for Men ,Shorts,Shorts,"['Sport Type:Basketball', 'Gender:Men']"
Womens Running Shorts Tights Short 2 IN 1  Women&#39;s Gym Cool Woman Sport Short Fitness Ladies Running Shorts Sportswear,Shorts,Shorts,"['Sport Type:Running', 'Gender:Women']"
Men&#39;s Fast Dry Sports Trainning Gym Running Shorts Breathable Workout Jogging Exercise Shorts,Shorts,Shorts Men&#39;s Fast Dry Sports Trainning Gym Running Shorts,"['Sport Type:Running', 'Gender:Men']"
2018 New Men&#39;s Shorts Tennis Men Basketball Shorts Breathable Elastic Pocket Soccer Jersey Basket Sportswear Loose Sport R,Shorts,Shorts,"['Model Number:0', 'Gender:Men']"
Men Sports Shorts Hombre Gym Dry Fit Spandex Workout Shorts Men Training Basketball Men Running Short Bermuda Male Fitness Sport,Shorts,Shorts,"['Sport Type:Running', 'Gender:Men']"
2018 Quick-dry Loose Beach Sport Shorts Men Basketball Jersey Shorts sport Shorts Fitness Gym Training Shorts Homme Drawstring,Shorts,Shorts,"['Sport Type:Basketball', 'Fabric Type:Jersey', 'Gender:Men']"
Original New Arrival  Adidas Three Stripes Women&#39;s  Shorts Sportswear,Shorts,Shorts,"['Brand Name:Adidas', 'Gender:Women']"
PENERAN Men Running Jogging Shorts Fitness Gym Shorts Man Sport Short Bandage Athletic Sport Wear Dry Fit 2018 Black White Gray,Shorts,Shorts,"['Gender:Men', 'Brand Name:PENERAN', 'Sport Type:Running']"
CALOFE 2018 Board Shorts Running Shorts Men Sporting Beaching Briefs Trousers Bodybuilding Sweatpants Fitness Short Jogger Gyms,Shorts,Shorts CALOFE,"['Gender:Men', 'Sport Type:Running']"
PEAK Men Running Shorts Light Weight Gym Workout Shorts Training Fitness Soccer Tennis Sports Shorts With Zip Pockets Quick Dry ,Shorts,Shorts,"['Gender:Men', 'Brand Name:PEAK']"
MM MASMIG The Fresh Prince of Bel-Air Academy Basketball Shorts Stitched Black S M L XL XXL              ,Shorts,Shorts MM MASMIG,['Sport Type:Basketball']
FANNAI Men&#39;s Running Shorts Breathable Trainning Sweatpants Fitness Bodybuilding Skinny Running Yoga Workout Short Pan,Shorts,Shorts,"['Sport Type:Running', 'Brand Name:FANNAI', 'Gender:Men']"
Original New Arrival 2018 Adidas Performance ESS 3S 3/4 FT P Men&#39;s Shorts Sportswear,Shorts,Shorts,"['Brand Name:Adidas', 'Gender:Men']"
New Workout Running Shorts Men Sports Jogging Short Pants Cotton Breathable gym Sport Shorts Men Bodybuilding Fitness Sweatpants,Shorts,Shorts,"['Sport Type:Running', 'Gender:Men']"
CM01 Professional Running Shorts Men Quick Dry Zip Pocket Breathable Running Workout  Gym Training Short  Fitness Tight  ,Shorts,Shorts CM01,"['Sport Type:Running', 'Gender:Men']"
2018 New Surfing Beach Shorts Women Summer Printed Quick Dry Shorts Swim Pockets Drawstring Boardshorts,Shorts,Shorts,"['Gender:Women', 'Pattern:Print']"
Mesh Waist Breathable Gym Men Shorts Black Color M-2XL Size Fitness Shorts Slim Blank High Elastic Sport Short Trousers JRDK052,Shorts,Shorts JRDK052,['Gender:Men']
2018 Men&#39;s Compression Tights Summer Shorts Mens Running Shorts Male Quick Dry Breathable Comfortable Men Sports Jogging Shorts,Shorts,Shorts,"['Sport Type:Running', 'Gender:Men']"
Women&#39;S Running Shorts Women&#39;S Sports Shorts Women&#39;S Tight Outdoors Sports Women&#39;S Wear-Resistant Sports Wear M/L/XL/XXL,Shorts,Shorts,"['Sport Type:Running', 'Gender:Women']"
Running Outdoor Exercise 5Colors Men Shorts Quick Dry String Crossfit Patchwork Short Trousers High Elastic Sweatpants JRDK015,Shorts,Shorts JRDK015,"['Sport Type:Running', 'Gender:Men']"
Women High Elastic Quick Dry Short Bodybuilding Joggers 7/10 Length Sweatpants Breathable String Trousers Tight Shorts YEL2032 ,Shorts,Shorts YEL2032,['Gender:Women']
Vertvie Men Running Shorts Summer Male Sportswear Solid Big Pockets Baggy Middle Loose Shorts Straight Male High Quality Shorts,Shorts,Shorts,"['Gender:Men', 'Pattern:Solid', 'Sport Type:Running']"
Adjustable Running Shorts Women Yoga Loose Sport Wear High Elastic Camouflage Jogging Fitness Shorts Female Quick Dry Short,Shorts,Shorts Running Shorts Women,"['Gender:Women', 'Pattern:Camouflage', 'Sport Type:Running']"
Leevy Athletic Training Shorts Men Running Marathon GYM Fitness Shorts Double Layer Quick Dry Breathable Workout Jogging Shorts,Shorts,Shorts Leevy,"['Sport Type:Running', 'Gender:Men']"
4 Colours Women Running Shorts Sport Shorts Fitness Gym Yoga Shorts Quick Dry Breathable Exercise Shorts Size S-XL 2018 New,Shorts,Shorts,"['Sport Type:Running', 'Gender:Women']"
Women 6Color Bodybuilding Shorts Yoga Jogger Blank Pocket Shorts High Elastic Slim Stretch Stitching Fast Dry Trousers QMF9032,Shorts,Shorts QMF9032,['Gender:Women']
2018 Buttocks Pure Color Bandage Sport Shorts Women Compression Breathable Running Shorts Yoga Gym Cycling Sport Short Mujer,Shorts,Shorts,"['Gender:Women', 'Sport Type:Running']"
ESHINES Running Shorts Womens Gym Shorts Tracking Sport Shorts For Woman Yoga Geometry Print Girls Panties Women Drop Shipping,Shorts,Shorts,"['Brand Name:ESHINES', 'Gender:Women', 'Pattern:Print', 'Sport Type:Running']"
2018 High Waist Compression Gym Women Shorts Fitness Sports Running Shorts Quick Dry Tight Fitting Sports Training Leggings,Shorts,Shorts,"['Sport Type:Running', 'Gender:Women']"
Sports Womens Running Shorts Running Tights Short Sports Exercise Fitness Leggings Gym Outdoor Female Trousers Brand New,Shorts,Shorts,"['Gender:Women', 'Sport Type:Running']"
DIQIAN Fitness Women Running Shorts Solid Color Famale Bodybuilding Sport Shorts High Waist Training Shorts Gym Yoga Shorts XL,Shorts,Shorts,"['Sport Type:Running', 'Gender:Women', 'Pattern:Solid', 'Brand Name:DIQIAN']"
2018 Men Sport Running Shorts Breathable Outdoor Workout Bodybuilding Multi Pocket Tennis Basketball Gym Training Short Fitness,Shorts,Shorts,"['Gender:Men', 'Sport Type:Running']"
Original New Arrival 2018 Adidas Originals EQT SHORTS Men&#39;s Shorts Sportswear,Shorts,Shorts,"['Brand Name:Adidas', 'Gender:Men']"
Hot Muscle Compression Golds Gym Fitness Running Sport Men Shorts Professional Bodybuilding Training Short Pants Men Wicking,Shorts,Shorts,"['Gender:Men', 'Sport Type:Running']"
Li-Ning 2018 Men Running Shorts 88% Polyester 12% Spandex Regular Fit Reflective Li Ning Breathable Sports Shorts AKSN245,Shorts,Shorts AKSN245,"['Sport Type:Running', 'Gender:Men']"
Kawasaki Mens Running Shorts 94% Polyester 6% Spandex Quick Dry Comfort Breathable Sports Shorts SP-173608,Shorts,Shorts SP-173608,"['Sport Type:Running', 'Gender:Men']"
ESHINES 2017 Running Shorts Women Spandex Gym Exercise Workout Training Athletic Sport Shorts Fitness Yoga Shorts Jogging Femme,Shorts,Shorts,"['Brand Name:ESHINES', 'Gender:Women', 'Sport Type:Running']"
BONJEAN Design 3 Dwyane Wade Printed Basketball Shorts With Pockets Quick Dry Breathable Training Mens Running Sport Shorts,Shorts,Shorts,"['Sport Type:Basketball', 'Brand Name:BONJEAN', 'Gender:Men', 'Pattern:Print', 'Model Number:BONJEAN']"
YINGRU 2018 new Zip woven shorts Men Running Shorts SHANGYING Adults Elastic Sports Shorts black colors,Shorts,Shorts,"['Sport Type:Running', 'Gender:Men']"
Men Elastic Waist Breathable Running Sports Shorts With Pocket Fitness Workout Gym Basketball Moisture wicking Quick Dry Shorts,Shorts,Shorts,"['Sport Type:Running', 'Gender:Men']"
Men  Quick-drying Shorts Running Basketball Riding Jogging Fitness Leggings Short Pants Gym Clothing Male Compression Tight,Shorts,Shorts,"['Sport Type:Running', 'Gender:Men', 'Model Number:Compression Tight']"
Vertvie Breathable Men&#39;s Knee length Leggings Tight Running Male Short Pants Quick Dry Quality Men Runnning Sport Shorts Legging,Shorts,Shorts,"['Gender:Men', 'Sport Type:Running']"
2017 New Women&#39;s Net Yarn Sports Shorts with Lined Anti-light Women Fitness Running Shorts Large Size Comfortable Sports Woman,Shorts,Shorts,"['Sport Type:Running', 'Gender:Women']"
Summer Breathable Beach Shorts Women Quick Dry Shorts Swimming Drawstring Shorts Sports Floral Printed,Shorts,Shorts,"['Gender:Women', 'Pattern:Print']"
FANNAI Men Sports Running Shorts Outdoor Fitness Bodybuilding Short pants Workout Sweatpants Men&#39;s Gym Training Quick Dry Shorts,Shorts,Shorts,"['Sport Type:Running', 'Gender:Men', 'Brand Name:FANNAI']"
2017 New Sexy Pocket Gym Women Shorts Fitness Tight Clothes for Yoga Sport Trousers Running Shorts,Shorts,Shorts,"['Sport Type:Running', 'Gender:Women']"
NEW 2017 Summer Sport Practice Basketball Shorts Running Trainnining Jogging Loose Ultla-light KD Elastic Plus Size XL-4XL HOT,Shorts,Shorts,['Sport Type:Basketball']
 Running Shorts Men Short Leggings Compression Tights Fitness Running Basketball Short Jogging Training Sports Shorts,Shorts,Shorts,"['Sport Type:Running', 'Gender:Men']"
B.BANG Women Sport Running Shorts Elastic Waist Woman Quick Dry Fitness Shorts Female Yoga Short Pants M/L/XL,Shorts,Shorts B.BANG,"['Sport Type:Running', 'Gender:Women']"
DIQIAN Fitness False Two Pieces Running Shorts Men Bodybuilding Solid Color Male Sport Shorts Tight Training Shorts Gym Size 4XL,Shorts,Shorts,"['Sport Type:Running', 'Gender:Men', 'Pattern:Solid', 'Brand Name:DIQIAN']"
Vertvie 2018 Men Camouflage Shorts Running Shorts Summer Sporting Loose For Male Fitness Running Bodybuilding Workout Shorts New,Shorts,Shorts,"['Gender:Men', 'Pattern:Camouflage', 'Sport Type:Running']"
Mens Letters Printed Sports Shorts Cotton Running Jogger Shorts Breathable Basketball Training Shorts ,Shorts,Shorts,"['Sport Type:Running', 'Pattern:Letter', 'Gender:Men', 'Feature:Breathable']"
High Elastic Men Mesh Shorts Pants Knee Length Shorts with Pockets Quick Dry Outdoor Running Sport Trousers Sportswear Wholesale,Shorts,Shorts,"['Gender:Men', 'Sport Type:Running']"
ESHINES 2 in 1 Mesh Sport Shorts Women Summer Plus Size Girl Running Cycling Gym Yoga Shorts For Lady Fitness Clothing Dropship,Shorts,Shorts,"['Brand Name:ESHINES', 'Gender:Women', 'Sport Type:Running']"
New Running Shorts Men Gym Fitness Shorts Embroidery Cotton Pocket Knee Length Jogging Workout Male Brand Sportswear MMA Shorts,Shorts,Shorts,"['Sport Type:Running', 'Gender:Men']"
Women Quick Drying Elastic Waist Surfing Shorts Athletic Fitness Running Short Pants Swimmer Water Sports Clothing,Shorts,Shorts,"['Sport Type:Running', 'Gender:Women']"
Original New Arrival 2018 NIKE Men&#39;s Shorts Sportswear,Shorts,Shorts,['Gender:Men']
OUTAD High Elastic Unsex Basketball Shorts with Pockets Quick Dry Knee Length Trousers Mesh Shorts Running Sport Sportswear,Shorts,Shorts OUTAD,['Sport Type:Basketball']
The Fresh Prince Of Bel Air Academy Mens Shorts Set All Stitched Black,Shorts,Shorts,['Gender:Men']
 New Style Running Tights Men Short Sport Leggings Compression Tights Skinny Gym Fitness Short Pants Training Sports Shorts,Shorts,Shorts,"['Sport Type:Running', 'Gender:Men']"
FANNAI Summer Quickly Dry Gym Sports Leggings Crossfit Running Shorts Men Jogger Trousers Compression Tights Running Shorts,Shorts,Shorts,"['Sport Type:Running', 'Gender:Men', 'Brand Name:FANNAI']"
2018 Women Athletic Running Short Trousers Yoga Breathable Patchwork Pocket Shorts Hiking Trousers Fast Dry Sportpants QMF9002,Shorts,Shorts,"['Sport Type:Running', 'Gender:Women', 'Model Number:QMF9002']"
Life On Track Cycling Tights Shorts Bottoms With Unique Printing Breathable Quick-dry Comfortable Bike Running Mountain,Shorts,Shorts,"['Pattern:Print', 'Sport Type:Running']"
3D Printed Women Shorts Boardshorts Sport Beach Shorts For Swimming Bermuda Surf Swimsuit Running Short Pants,Shorts,Shorts,"['Sport Type:Running', 'Gender:Women', 'Pattern:Print']"
Workout Yoga Shorts Women Black Gray Color Blank Gym Shorts New Quick Dry Running Shorts Women Trousers Slim Soft Shorts JRDK047,Shorts,Shorts,"['Sport Type:Running', 'Gender:Women', 'Model Number:JRDK047']"
Original New Arrival  Adidas WOVEN SLITSHORT Women&#39;s Shorts Sportswear,Shorts,Shorts,"['Gender:Women', 'Brand Name:Adidas']"
Original New Arrival 2018 Adidas D2M W SHORT Women&#39;s  Shorts Sportswear ,Shorts,Shorts,"['Gender:Women', 'Brand Name:Adidas']"
ROCKBROS Quick Drying Running Shorts Ice Silk Sport Fitness Gym Shorts Vest Set Running Shorts Men Women Cycling Sweatpants Sets,Shorts,Shorts ROCKBROS,['Gender:Men']
High Elastic Slim Short Leggings Logo Print Black Color Men Shorts Running Fast Dry Bodybuilding Training Short Trousers JRDK044,Shorts,Shorts,"['Sport Type:Running', 'Model Number:JRDK044', 'Gender:Men']"
Men Ultra Light Shorts Man&#39;s Sports Running Football Shorts With Pocket Mesh Gym Soccer Basketball Jogging Jogger Boxer Shorts ,Shorts,Shorts,"['Sport Type:Running', 'Gender:Men']"
Vertvie Traing &amp; Running Shorts Men Solid Loose Gym Fitness Shorts Men Quick Dry Quality Beach Knee Drawstring 2018 New For Man,Shorts,Shorts,"['Gender:Men', 'Sport Type:Running']"
Vertvie Running Sport Shorts Men&#39;s Trousers With Pocket Fitness Jogging 2018 Summer Gray Sport Basketball Soccer Shorts Male,Shorts,Shorts,"['Gender:Men', 'Sport Type:Running']"
New Basketball Shorts With Pocket Men Sportswear High Quality Training Breathable Loose Sports Clothes Elastic Sport Shorts,Shorts,Shorts,"['Sport Type:Basketball', 'Gender:Men']"
Men Gym Running Tight Short Pants Sexy Breathable Basketball Running Shorts,Shorts,Shorts,"['Sport Type:Running', 'Gender:Men', 'Model Number:Running Shorts']"
Original New Arrival 2018 Adidas ESS LIN SHOR SJ Men&#39;s Shorts Sportswear,Shorts,Shorts,"['Brand Name:Adidas', 'Gender:Men']"
2018 Safety Honeycomb Tight Fitness Anti Collision Shorts Basketball Sports Anti Compression Shorts Sportswear,Shorts,Shorts,"['Sport Type:Basketball', 'Model Number:1']"
Souteam Mens Running Shorts Sports Quick Dry Light Weight Bodybuilding Sweatpants Fitness shorts Gyms Men Shorts Workout,Shorts,Shorts,"['Sport Type:Running', 'Gender:Men']"
New Running Sport Mens Basketball Tight Compression Shorts Gym Fitness Clothing Training Wicking Short Pants Homme,Shorts,Shorts,"['Gender:Men', 'Sport Type:Running']"
Vertvie Men Running Shorts Summer Short Solid Military Short Male Loose Knee Length Man Sportswear Plus Size 2018 New Quick Dry,Shorts,Shorts,"['Gender:Men', 'Pattern:Solid', 'Sport Type:Running']"
ZRCE Brand Mens Gym Shorts Run jogging sports Fitness bodybuilding Sweatpants male profession workout training Brand short pants,Shorts,Shorts ZRCE,['Gender:Men']
Adidas Original New Arrival Official Climachill SH Men&#39;s Black Shorts Sportswear BR9125,Shorts,Shorts,"['Gender:Men', 'Brand Name:Adidas', 'Model Number:BR9125']"
Men Tight Foottball Fitness Shorts High Flexible Fast Dry Bodybuilding Training Short Trousers Blank Knee Length Shorts YEL1014,Shorts,Shorts YEL1014,['Gender:Men']
2018 Men&#39;s Stitching Casual Sports Shorts Running Basketball Fitness Training Shorts Breathable Stretch Quick Dry Shorts,Shorts,Shorts,"['Sport Type:Running', 'Gender:Men']"
WOSAWE 2018 Men Running Shorts Quick Dry Bodybuilding Sweatpants Fitness Shorts Jogger Sports Gyms Sportswear,Shorts,Shorts,"['Brand Name:WOSAWE', 'Gender:Men', 'Sport Type:Running']"
