input,category,context,filter
"Harney & Sons Mulled Plum Cider, 4 oz Loose Leaf Tea",Tea,Tea Mulled Plum Cider 4 oz,"['Brand:Harney & Sons', 'Item form:Loose Leaf Tea']"
"Two Leaves and a Bud Alpine Berry Herbal Tea, Tea Bags, 15-Count Box",Tea,Tea Two Leaves and a Bud Alpine Berry 15-Count Box,"['Tea variety:Herbal Tea', 'Item form:Tea Bags']"
"Two Leaves and a Bud Organic Assam Breakfast Tea Bags, Whole Leaf Black Tea in Sachets, 100 Count",Tea,Tea Two Leaves and a Bud Assam Breakfast,"['Specialty:Organic', 'Item form:Sachets', 'Tea variety:Black Tea', 'Net content:100 Count']"
"MORINGA + MATCHA Green Tea Powder - POWERFUL SUPERFOODS BLEND (25 Servings) - Pure Japanese Matcha Powder with Authentic Indian Moringa Powder 137x ANTI-OXIDANTS, Delicious Matcha Latte",Tea,Tea Moringa 25 Servings Delicious Matcha Latte,"['Item form:Powder', 'Specialty:137x ANTI-OXIDANTS,', 'Country:Indian']"
"Celestial Seasonings Herbal Tea, Red Zinger, 20 Count",Tea,Tea Red Zinger,"['Brand:Celestial Seasonings', 'Tea variety:Herbal Tea', 'Net content:20 Count']"
Oi Ocha Unsweetened Bold Green Tea 2 Liter Bottle (Pack of 6) Unsweetened Zero Calories,Tea,Tea Bold Green Tea 2 Liter Bottle,"['Flavor:Oi Ocha', 'Specialty:Unsweetened Zero Calories', 'Pack size:Pack of 6']"
Pukka Organic Herbal Latte Turmeric Glow 2.65 oz,Tea,Tea Pukka Herbal Latte Turmeric Glow 2.65 oz,['Specialty:Organic']
"Bravo Tea, Schisandra Berry Tea, Caffeine Free, 20 Tea Bags",Tea,Tea Bravo Tea Schisandra Berry,"['Caffeine content:Caffeine Free', 'Net content:20', 'Item form:Tea Bags']"
"The Republic of Tea, Kiwi Pear Tea, 50-Count",Tea,Tea Kiwi Pear Tea 50-Count,['Brand:The Republic of Tea']
"Salem Botanicals Herbal Tea, Kidney Support, 20 Count",Tea,Tea Salem Botanicals,"['Tea variety:Herbal Tea', 'Specialty:Kidney Support', 'Net content:20 Count']"
"Allegro Tea, Organic Splendid Oolong Tea Bags, 20 ct",Tea,Tea Splendid Oolong,"['Brand:Allegro Tea', 'Specialty:Organic', 'Item form:Tea Bags', 'Net content:20 ct']"
"Davidson's Tea Bulk, Decaf Green, 16-Ounce Bag",Tea,Tea Bulk Green 16-Ounce Bag,"[""Brand:Davidson's"", 'Caffeine content:Decaf']"
"Amazon Brand - Happy Belly Tea Pods Compatible with 2.0 K-Cup Brewers, Green Tea, 24 Count (Previously Solimo)",Tea,Tea Previously Solimo Tea Pods 24 Count,"['Machine type:Compatible with 2.0 K-Cup Brewers', 'Tea variety:Green Tea']"
"Twinings of London Pure Camomile Herbal Tea Bags, 20 Count (Pack of 6)",Tea,Tea Pure Camomile Herbal Tea,"['Brand:Twinings of London', 'Item form:Bags', 'Net content:20 Count', 'Pack size:Pack of 6']"
"Traditional Medicinals Mother's Milk Women's Tea Organic, 16 Ct",Tea,Tea Mother's Milk Women's Tea 16 Ct,"['Brand:Traditional Medicinals', 'Specialty:Organic']"
Earl Grey Creme Black Tea Sampler - Art of Tea 12 Pyramid Tea Bag Sachets,Tea,Tea Earl Grey Creme Pyramid Tea Bag Sachets Art of Tea 12,['Tea variety:Black Tea']
"Takaokaya Tea T Green Sencha, TeaBags, 64 Count Unit",Tea,Tea Takaokaya TeaBags 64 Count Unit,['Tea variety:Green Sencha']
Rose Chamomile Lavender Herbal Tea 60 Cups - Stress Relief Bedtime Calming and Relaxing Caffeine Free Loose Leaf Organic Tea by The Tea Company 4oz,Tea,Tea Rose Chamomile Lavender 4oz The Tea Company,"['Tea variety:Herbal Tea', 'Specialty:Organic Tea', 'Caffeine content:Caffeine Free', 'Item form:Loose Leaf']"
"Twinings of London Pure Peppermint Herbal Tea Bags, 20 Count (Pack of 1)",Tea,Tea Pure Peppermint,"['Brand:Twinings of London', 'Tea variety:Herbal Tea', 'Item form:Bags', 'Net content:20 Count', 'Pack size:Pack of 1']"
"Celestial Seasonings Herbal Tea, Vermont Maple Ginger, 20 Count (Pack of 6)",Tea,Tea Vermont Maple Ginger,"['Brand:Celestial Seasonings', 'Tea variety:Herbal Tea', 'Net content:20 Count', 'Pack size:Pack of 6']"
Celebration Herbals Calendula Flower Herbal Tea - 24 Tea Bags,Tea,Tea Celebration Herbals 24,"['Tea variety:Calendula Flower Herbal Tea', 'Item form:Tea Bags']"
Trader Joes Green Tea Infused Mints (Pack of 4),Tea,Tea Trader Joes Infused Mints,"['Tea variety:Green Tea', 'Pack size:Pack of 4']"
ASI Yaupon Tea Sampler Pack (10 Tea Bags),Tea,Tea ASI 10,"['Tea variety:Yaupon Tea', 'Item form:Tea Bags']"
Hojas de Guanabana Soursop Leaves Herbal Tea Zip-Lock (35g),Tea,Tea Hojas de Guanabana Soursop Leaves 35g,['Tea variety:Herbal Tea']
Traditional Medicinals Tea Nettle Leaf Herbal,Tea,Tea,"['Brand:Traditional Medicinals', 'Tea variety:Nettle Leaf Herbal']"
"Herbalife Herbal Tea Concentrate (Original, 3.6 OZ (102g))",Tea,Tea Herbalife Concentrate 3.6 OZ (102g),"['Tea variety:Herbal Tea', 'Flavor:Original']"
"Bigelow English Breakfast Black Tea Bags, 100 Count Box Caffeinated Black Tea",Tea,Tea Bigelow 100 Count Box,"['Flavor:English Breakfast', 'Tea variety:Black Tea', 'Item form:Bags', 'Caffeine content:Caffeinated']"
"Twinings of London English Afternoon Black Tea Bags, 20 Count (Pack of 6)",Tea,Tea English Afternoon Black,"['Brand:Twinings of London', 'Item form:Tea Bags', 'Net content:20 Count', 'Pack size:Pack of 6']"
Jinglong Tea Factory - Puerh Tea Original (150 Cups) Ripe Pu-erh Tea Cake (12.6 Ounce),Tea,Tea Jinglong Tea Factory Puerh Tea 12.6 Ounce Ripe Pu-erh Tea Cake,['Flavor:Original']
Jade Leaf Organic Ceremonial Grade Matcha Green Tea Powder - Authentic Japanese Origin - Teahouse Edition Premium First Harvest (1.06 Ounce),Tea,Tea Jade Leaf Matcha Green Tea 1.06 Ounce,"['Specialty:Teahouse Edition Premium First Harvest', 'Item form:Powder', 'Country:Authentic Japanese Origin']"
"Celestial Seasonings Herbal Tea, Fruit Tea Sampler, 18 Count (Pack of 6)",Tea,Tea Fruit Tea Sampler 18 Count,"['Brand:Celestial Seasonings', 'Tea variety:Herbal Tea', 'Pack size:Pack of 6']"
"Luzianne Specially Blended gallon Size Iced Tea Bags, 24 Count Box",Tea,Tea Luzianne Specially Blended gallon Size Iced Tea Bags 24 Count Box,[]
"Newman's Own Organics 100 Individually Wrapped Tea Bags, Black Tea, 100 Teabags (Pack of 5)",Tea,Tea Newman's Own Organics,"['Net content:100', 'Item form:Teabags', 'Tea variety:Black Tea', 'Pack size:Pack of 5']"
"Global Moringa Tea - Original Organic Moringa Tea (30 Tea Bags) Ghana Grown, American Seller",Tea,Tea Global Moringa Moringa Tea 30,"['Flavor:Original', 'Specialty:Organic', 'Item form:Tea Bags', 'Country:American Seller']"
"SoMo Tea, Premium Loose Leaf Tea Sampler Set | Sweet Dreams | 6 Flavor Hot or Iced Herbal and Fruit Tea, Low and No Caffeine, Variety Pack, Gift Box Set",Tea,"Tea SoMo Tea Variety Pack, Gift Box Set 6 Flavor Hot or Iced Herbal and Fruit Tea",['Caffeine content:Low and No Caffeine']
"TWG Tea 1837, Classic Tea Selection, 15 count Hand Sewn Cotton Teabags, (1 Pack)",Tea,Tea TWG Tea 1837 Classic Tea Selection 15 count Cotton Teabags,['Pack size:1 Pack']
"Crystal Light Lemon Decaf Iced Tea Natural Flavor Drink Mix, 12-Quart Canister (Pack of 6)",Tea,Tea Natural Flavor 12-Quart Canister,"['Brand:Crystal Light', 'Caffeine content:Decaf', 'Tea variety:Iced Tea', 'Item form:Drink Mix', 'Pack size:Pack of 6']"
"Celestial Seasonings Herbal Tea, True Blueberry, 20 Count (Pack of 6)",Tea,Tea True Blueberry,"['Brand:Celestial Seasonings', 'Tea variety:Herbal Tea', 'Net content:20 Count', 'Pack size:Pack of 6']"
"Celestial Seasonings Herbal Tea, Sleepytime Mint, 20 count (Pack of 6)",Tea,Tea Sleepytime Mint 20 count,"['Brand:Celestial Seasonings', 'Tea variety:Herbal Tea', 'Pack size:Pack of 6']"
"Gold Kili Instant Ginger Beverage, 12.60 Ounce",Tea,Tea Gold Kili Instant Ginger Beverage 12.60 Ounce,[]
Buddha Teas Organic Fennel Seed Tea 18 Tea Bags,Tea,Tea Buddha Teas Fennel Seed Tea 18,"['Specialty:Organic', 'Item form:Tea Bags']"
Imozai Organic Black Tea Bags 100 Count Individually Wrapped,Tea,Tea Imozai Individually Wrapped,"['Specialty:Organic', 'Tea variety:Black Tea', 'Net content:100 Count']"
"Tejava Unsweetened Black Tea with Natural Peach Flavor Pods, Award-Winning Tea, 100% recyclable Single Serve Cups (24 Pack)",Tea,Tea Tejava Award-Winning Tea Natural Peach Flavor 100% recyclable Single Serve Cups 24 Pack,['Tea variety:Black Tea']
"Organic Sweet Matcha Green Tea Powder, Cafe Style Blend by Cherie Sweet Heart (16 oz) (packaging may vary)",Tea,Tea Cafe Style Blend Cherie Sweet Heart 16 oz,"['Specialty:Organic', 'Tea variety:Green Tea', 'Item form:Powder']"
Dong Suh Korean Tea (50 Bags) (Solomon's Seal Tea),Tea,Tea Dong Suh Korean Solomon's Seal Tea,"['Net content:50', 'Item form:Bags']"
"Teas' Tea Unsweetened Golden Oolong Tea 16.9 Ounce (Pack of 12), Sugar Free, 0 Calories",Tea,"Tea Teas' Tea Sugar Free, 0 Calories Golden Oolong Tea","['Net content:16.9 Ounce', 'Pack size:Pack of 12']"
Lipton Tea Bags - Green Tea - 100ct Box,Tea,Tea Lipton 100ct Box,"['Item form:Tea Bags', 'Tea variety:Green Tea']"
"Celestial Seasonings Herbal Tea,Country Peach Passion, (2 Pack)",Tea,Tea Country Peach Passion,"['Brand:Celestial Seasonings', 'Tea variety:Herbal Tea', 'Pack size:2 Pack']"
"Ito En Tea Oi Ocha Green Tea, Unsweetened, 16.9 Ounce (Pack of 12)",Tea,Tea Ito En Unsweetened,"['Flavor:Oi Ocha', 'Tea variety:Green Tea', 'Net content:16.9 Ounce', 'Pack size:Pack of 12']"
"The Tao of Tea, Imperial White Tea, Loose Leaf, 1.5 Ounce Tins",Tea,Tea The Tao of Tea Imperial White Tea 1.5 Ounce Tins,['Item form:Loose Leaf']
Crystal Light Peach Mango Green Tea Drink Mix (5 Pitcher Packets),Tea,Tea 5 Pitcher Packets,"['Brand:Crystal Light', 'Flavor:Peach Mango', 'Tea variety:Green Tea', 'Item form:Drink Mix']"
"Twinings of London Irish Breakfast Loose Tea Tin, 3.53 Ounces",Tea,Tea Irish Breakfast Loose Tea Tin 3.53 Ounces,['Brand:Twinings of London']
"Twinings of London Premium Black Tea Mixed Berry, 20 Count (Pack of 6)",Tea,Tea Premium Black Tea Mixed Berry,"['Brand:Twinings of London', 'Net content:20 Count', 'Pack size:Pack of 6']"
"Rishi Tea Herbal Tea For Immune Support (USDA Certified Organic/Fair Trade/Caffeine-Free), Blueberry Hibiscus, 50 Count",Tea,Tea USDA Certified Organic/Fair Trade 50 Count,"['Brand:Rishi Tea', 'Tea variety:Herbal Tea', 'Caffeine content:Caffeine-Free', 'Flavor:Blueberry Hibiscus']"
"Rishi Tea Rishi Loose Leaf Herbal Tea, Makes 75 Cups, Cinnamon Plum, 16 Oz",Tea,Tea Rishi 16 Oz,"['Item form:Loose Leaf', 'Tea variety:Herbal Tea', 'Flavor:Cinnamon Plum']"
"Harney & Sons Venetian Tiramisu, 2 oz Loose Leaf Tea w/ Cocoa, Vanilla, and Brandy",Tea,"Tea Cocoa, Vanilla, and Brandy 2 oz","['Brand:Harney & Sons', 'Item form:Loose Leaf Tea']"
"Big Train Chai Tea Latte, Raspberry, 56 Ounce, Powdered Instant Chai Tea Latte Mix (Packaging May Vary)",Tea,Tea Big Train Chai Tea Latte 56 Ounce Powdered Instant Chai Tea Latte Mix,['Flavor:Raspberry']
"Arizona Green Tea with Ginseng and Honey, 16 Fl Oz (Pack of 12)",Tea,Tea Arizona Ginseng and Honey 16 Fl Oz,"['Tea variety:Green Tea', 'Pack size:Pack of 12']"
"Tea of a Kind Yerba Mate Tea, Raspberry, 192 Fl Oz, Pack Of 12",Tea,Tea Tea of a Kind 192 Fl Oz,"['Tea variety:Yerba Mate Tea', 'Flavor:Raspberry', 'Pack size:Pack Of 12']"
Stash Tea Spicy Licorice Tea - 20 ct,Tea,Tea Stash Spicy Licorice Tea,['Net content:20 ct']
"Positively Tea Company, Organic Orange Blossom Special, Oolong Tea, Loose Leaf, 16 Ounce",Tea,Tea Positively Tea Company Orange Blossom Special,"['Specialty:Organic', 'Tea variety:Oolong Tea', 'Item form:Loose Leaf', 'Net content:16 Ounce']"
"Harney & Sons Chocolate Black Tea, Florence, Hazelnut, 4 Ounce",Tea,"Tea Florence, Hazelnut 4 Ounce","['Brand:Harney & Sons', 'Tea variety:Black Tea']"
"Celestial Seasonings Fireside Vanilla Spice Tea, 20 Tea Bags",Tea,Tea Fireside Vanilla Spice Tea,"['Brand:Celestial Seasonings', 'Net content:20', 'Item form:Tea Bags']"
Youthberry Wild Orange Blossom Tea Blend by Teavana,Tea,Tea Youthberry Wild Orange Blossom Tea Blend Teavana,[]
"Celestial Seasonings Spiced Espresso Chai Tea, (2 Pack)",Tea,Tea Spiced Espresso Chai Tea,"['Brand:Celestial Seasonings', 'Pack size:2 Pack']"
"Lipton Green Tea K-Cups, Green Tea Chamomile Mint 12 ct",Tea,Tea Lipton Chamomile Mint 12 ct,"['Tea variety:Green Tea', 'Item form:K-Cups']"
"Bigelow Green Tea with Wild Blueberry & Acai, 20 Count Box (Pack of 6), Caffeinated Green Tea, 120 Teabags Total",Tea,Tea Bigelow Wild Blueberry & Acai 120,"['Tea variety:Green Tea', 'Pack size:Pack of 6', 'Caffeine content:Caffeinated', 'Item form:Teabags']"
"Harney & Sons Hot Cinnamon Spice Tea, 50 Tea Bags",Tea,Tea Hot Cinnamon Spice,"['Brand:Harney & Sons', 'Net content:50', 'Item form:Tea Bags']"
"Teavana Peach Tranquility, Herbal Tea With Chamomile and Notes of Citrus (1 pack of 15 sachets)",Tea,Tea Teavana Chamomile and Notes of Citrus 15 sachets,"['Tea variety:Herbal Tea', 'Pack size:1 pack']"
Rosamonte Special Selection Yerba Mate Tea (2.2 lbs/1 kilo),Tea,Tea Rosamonte Special Selection 2.2 lbs/1 kilo,['Tea variety:Yerba Mate Tea']
"Positively Tea Company, Organic Ti Kuan Yin Oolong Tea, Loose Leaf, 16 Ounce",Tea,Tea Positively Tea Company Ti Kuan Yin,"['Specialty:Organic', 'Tea variety:Oolong Tea', 'Item form:Loose Leaf', 'Net content:16 Ounce']"
"Celestial Seasonings Sleepytime Herbal Tea, Single-Serve Keurig K-Cup Pods, 72 Count",Tea,Tea Sleepytime Single-Serve Keurig K-Cup Pods 72 Count,"['Brand:Celestial Seasonings', 'Tea variety:Herbal Tea']"
Yan Hou Tang Taiwan Black Tea Loose Leaf Organic Leaves Sun Moon Lake Red Jade Caffeine 75g 30 Servings - Nature High Mountain Unique Honey Flavor Sachet English Breakfast Tea Half Fermented,Tea,Tea Yan Hou Tang Taiwan Sachet Half Fermented English Breakfast Tea Caffeine 75g 30 Servings,['Tea variety:Black Tea']
"Yogi Tea,16 Tea Bags (Perfect Energy Raspberry Passion, 1 Pack)",Tea,Tea Yogi Tea Perfect Energy Raspberry Passion,"['Net content:16', 'Item form:Tea Bags', 'Pack size:1 Pack']"
"Rishi Tea Matcha Super Green Herbal Tea | Immune Support, USDA Certified Organic Sencha, Highly Caffeinated, Umami, Antioxidants | 15 Sachet Bags, 1.43 oz (Pack of 2)",Tea,Tea Umami Sencha Antioxidants 1.43 oz Sachet Bags,"['Brand:Rishi Tea', 'Caffeine content:Highly Caffeinated', 'Pack size:Pack of 2']"
"Edinburgh Tea & Coffee Company Highland Blend Tea, 25 Count Teabags",Tea,Tea Edinburgh Tea & Coffee Company Highland Blend Tea 25 Count,['Item form:Teabags']
"The Republic Of Tea Honey Mango 100% White Tea, 50 Tea Bag Tin",Tea,Tea Honey Mango 100% White Tea Tin,"['Brand:The Republic Of Tea', 'Net content:50']"
"Numi Organic Tea Rooibos Chai, 16 Ounce Pouch, Loose Leaf Herbal Teasan, Caffeine-Free",Tea,Tea Numi Herbal Teasan 16 Ounce Pouch,"['Specialty:Organic', 'Item form:Loose Leaf', 'Caffeine content:Caffeine-Free']"
Traditional Medicinals Organic Smooth Move Chamomile 16 Ct,Tea,Tea Smooth Move Chamomile 16 Ct,"['Brand:Traditional Medicinals', 'Specialty:Organic']"
"Celestial Seasonings Herbal Tea, Rooibos Madagascar Vanilla, 20 Count (Pack of 6)",Tea,Tea Rooibos Madagascar Vanilla,"['Brand:Celestial Seasonings', 'Net content:20 Count', 'Pack size:Pack of 6']"
BTC00388CT - Bigelow Classic Green Tea,Tea,Tea Bigelow Classic,['Tea variety:Green Tea']
"Gts, Kombucha Synergy Watermelon Wonder, 16 Fl Oz, 12 Pack",Tea,Tea Gts Kombucha Watermelon Wonder 16 Fl Oz 12 Pack,[]
Whittard Tea Earl Grey 50 Traditional Teabags 125g,Tea,Tea Whittard 125g Traditional Teabags,['Flavor:Earl Grey']
"Numi Organic Tea Chocolate Pu-erh, 16 Ounce Pouch, Loose Leaf Black Tea (Packaging May Vary)",Tea,Tea Numi Chocolate Pu-erh 16 Ounce Pouch Black Tea ,"['Specialty:Organic Tea', 'Item form:Loose Leaf']"
"BC BONACURE Hyaluronic Moisture Kick Spray Conditioner, 6.8-Ounce",Conditioner,Conditioner BC BONACURE Hyaluronic Moisture Kick 6.8-Ounce,['Item form:Conditioner']
"Aussie Paraben-Free Total Miracle 3 Minute Miracle Conditioner w/ Apricot for Damaged Hair, 8.0 fl oz",Conditioner,Conditioner Total Miracle 3 Minute Miracle Apricot 8.0 fl oz,"['Specialty:Paraben-Free', 'Item form:Conditioner', 'Hair type:Damaged Hair']"
GRAVE BEFORE SHAVE BEARD Conditioner,Conditioner,Conditioner GRAVE BEFORE SHAVE BEARD,['Item form:Conditioner']
Barbie Cotton Candy Scented Hair Detangler 8oz (Pack of 3),Conditioner,Conditioner Barbie Cotton Candy Scented Hair Detangler,"['Volume:8oz', 'Pack size:Pack of 3']"
Chris Christensen Ice on Ice Detangling Conditioner 16oz,Conditioner,Conditioner Chris Christensen Ice on Ice 16oz,"['Benefit:Detangling', 'Item form:Conditioner']"
"It's a 10 Haircare Miracle Leave-In for Blondes, 4 fl. oz.",Conditioner,Conditioner It's a 10 Haircare Leave-In Blondes 4 fl. oz,[]
Sun Bum Curls & Waves Conditioner | Vegan and Cruelty Free Moisturizing Hair Treatment for Wavy and Curly Hair | 10 oz,Conditioner,Conditioner Sun Bum Curls & Waves Conditioner Moisturizing Hair Treatment Wavy and Curly Hair 10 oz,['Specialty:Cruelty Free']
"John Frieda Brilliant Brunette Visibly Deeper Colour Deepening Conditioner, 8.3 Ounces",Conditioner,Conditioner Brunette Deepening 8.3 Ounces,"['Brand:John Frieda', 'Item form:Conditioner']"
"Bumble and Bumble Super Rich Conditioner, 8 Fl Oz",Conditioner,Conditioner Bumble and Bumble Super Rich 8 Fl Oz,['Item form:Conditioner']
"AMERICAN CREW Daily Conditioner for Men, 33.8 Fl Oz",Conditioner,Conditioner AMERICAN CREW 33.8 Fl Oz,"['Item form:Conditioner', 'Gender:Men']"
Glop & Glam Cake Butter Hydrating Conditioner -Size 10.7 oz,Conditioner,Conditioner Glop & Glam Cake Butter,"['Benefit:Hydrating', 'Item form:Conditioner', 'Pack size:Size 10.7 oz']"
"Philip Kingsley Elasticizer Deep-Conditioning Treatment, 5.07 oz",Conditioner,Conditioner Philip Kingsley Elasticizer Deep-Conditioning Treatment 5.07 oz,[]
"Shea Moisture Fruit Fusion Coconut Water Weightless Creme Rinse1, 13 Ounce",Conditioner,Conditioner Fruit Fusion Coconut Water Weightless Creme Rinse 13 Ounce,['Brand:Shea Moisture']
"AG Hair Colour Care Sterling Silver Toning Conditioner, 6 Fl Oz",Conditioner,Conditioner AG Hair 6 Fl Oz,['Benefit:Conditioner']
"Avalon Organics Conditioner, Volumizing Rosemary, 11 Oz",Conditioner,Conditioner Avalon Organics Rosemary 11 Oz,"['Item form:Conditioner', 'Benefit:Volumizing']"
"Curls Coconut Curlada Conditioner, 8 Oz",Conditioner,Conditioner Curls Coconut Curlada 8 Oz,['Item form:Conditioner']
"Aveda Damage Remedy Conditioner, 6.7 Ounce",Conditioner,Conditioner Damage Remedy 6.7 Ounce,"['Brand:Aveda', 'Item form:Conditioner']"
"Just For Men Control GX 2 in 1 Grey Reducing Shampoo and Conditioner, 5 Fluid Ounce",Conditioner,Conditioner Just For Men Control GX Grey Reducing Shampoo and Conditioner 5 Fluid Ounce,[]
"Camille Rose Almond Jai Twisting Butter, 8 fl oz",Conditioner,Conditioner Camille Rose Almond Jai Twisting Butter,['Volume:8 fl oz']
"Hollywood Beauty Olive Cholesterol, 20 oz (Pack of 2)",Conditioner,Conditioner Hollywood Beauty Olive Cholesterol 20 oz,['Pack size:Pack of 2']
John Frieda Miraculous Recovery Deep Conditioner 150ml,Conditioner,Conditioner Miraculous Recovery 150ml,"['Brand:John Frieda', 'Item form:Deep Conditioner']"
"Babo Botanicals Moisturizing Baby Conditioner with Colloidal Oatmeal and Organic, calendula 6 Ounce",Conditioner,Conditioner Babo Botanicals 6 Ounce calendula Organic,"['Benefit:Moisturizing', 'Age:Baby']"
Grisi Manzanilla Gold Lightener and Detangler 8.4 Ounce,Conditioner,Conditioner Grisi Manzanilla Gold,"['Benefit:Detangler', 'Volume:8.4 Ounce']"
"OGX Kukui Oil Conditioner, Hydrate & Defrizz, 13 Ounces",Conditioner,Conditioner Kukui Oil Hydrate & Defrizz 13 Ounces,"['Brand:OGX', 'Item form:Conditioner']"
"Design Essentials Agave & Lavender Moisturizing Hair Bath, Sulfate-Free Shampoo- Blow-Dry & Silk Press Collection - 12oz",Conditioner,Conditioner Agave & Lavender Sulfate-Free Blow-Dry & Silk Press Collection,"['Brand:Design Essentials', 'Benefit:Moisturizing', 'Item form:Shampoo', 'Volume:12oz']"
"Renpure Originals 2003 Argan Oil Luxurious Conditioner, 32 Fluid Ounce",Conditioner,Conditioner Renpure Originals 32 Fluid Ounce,"['Scent:Argan Oil', 'Item form:Conditioner']"
"Light Mountain Natural Hair Color & Conditioner, Medium Brown, 4 oz (113 g) (Pack of 3)",Conditioner,Conditioner Light Mountain Medium Brown 4 oz (113 g),"['Benefit:Conditioner', 'Pack size:Pack of 3']"
"Alikay Naturals Honey And Sage, Deep Conditioner, Yellow, 8 Ounce (LK-10605)",Conditioner,Conditioner Alikay Naturals Honey And Sage,"['Item form:Deep Conditioner', 'Volume:8 Ounce']"
EBIN NEW YORK 24 HOUR Wig Shine Spray 28.5 oz / 250m,Conditioner,Conditioner EBIN NEW YORK Wig Shine 28.5 oz / 250m,['Item form:Spray']
Avyna Maschera Laluronico Intensive Hiar Conditioner,Conditioner,Conditioner Avyna Maschera Laluronico Intensive Hiar Conditioner,[]
"Viking Revolution Beard Balm - All Natural Grooming Treatment with Argan Oil & Mango Butter - Strengthens & Softens Beards & Mustaches - Leave in Conditioner Wax for Men (Citrus and Sandalwood Scents, Pack of 2)",Conditioner,Conditioner Viking Revolution Beards & Mustaches Leave in Conditioner Wax Strengthens & Softens Citrus and Sandalwood Scents,"['Specialty:All Natural', 'Gender:Men', 'Pack size:Pack of 2']"
"Fairy Tales Rosemary Repel Lice Shampoo- Daily Kids Shampoo for Lice Prevention, 12 Fl. Oz (Pack of 1)",Conditioner,Conditioner Lice Shampoo 12 Fl. Oz,"['Brand:Fairy Tales', 'Scent:Rosemary Repel', 'Age:Kids', 'Item form:Shampoo', 'Benefit:Lice Prevention', 'Pack size:Pack of 1']"
"Just for Me Curl Peace Ultimate Detangling Conditioner (3 Pack) - Nourishes & Replenishes, Contains Marshmallow Root Extract, Cocoa Butter & Raw Honey, Sulfate Free, No Animal Testing, 12 oz",Conditioner,"Conditioner Just for Me Curl Peace Replenishes Contains Marshmallow Root Extract, Cocoa Butter & Raw Honey No Animal Testing 12 oz","['Item form:Conditioner', 'Pack size:3 Pack']"
Jane Carter Solution Curls To Go Untangle Me 8OZ (Untangle Me),Conditioner,Conditioner Untangle 8OZ,"['Brand:Jane Carter Solution', 'Hair type:Curls']"
GRAVE BEFORE SHAVE Cigar Blend Beard Pack (Cigar/Vanilla Scent),Conditioner,Conditioner GRAVE BEFORE SHAVE Cigar/Vanilla Scent,['Hair type:Beard']
"Carols Daughter Hair Milk Nourishing & Conditioning Cleansing Conditioner, 12 Ounce",Conditioner,Conditioner Carols Daughter 12 Ounce,"['Item form:Conditioner', 'Benefit:Cleansing']"
"Design Essentials Milk & Honey 6N1 Reconstructive Conditioner, 32oz",Conditioner,Conditioner Milk & Honey Reconstructive 32oz,"['Brand:Design Essentials', 'Item form:Conditioner']"
"Maui Moisture Thicken & Restore + Bamboo Fibers Conditioner, 385ml",Conditioner,Conditioner Maui Moisture Thicken & Restore Bamboo Fibers 385ml,['Item form:Conditioner']
Detroit Grooming Co. - 4 oz. Beard Butter Double The Size - 'Black' Amber Bourbon - Beard Balm,Conditioner,Conditioner Detroit Grooming Co. Double The Size 'Black' Amber Bourbon,"['Hair type:Beard', 'Item form:Balm']"
"Fairy Tales Rosemary Repel Daily Kids Hair Conditioner for Lice Prevention, 8 Fl Oz (Pack of 1)",Conditioner,Conditioner 8 Fl Oz,"['Brand:Fairy Tales', 'Scent:Rosemary Repel', 'Age:Kids', 'Item form:Hair Conditioner', 'Benefit:Lice Prevention', 'Pack size:Pack of 1']"
"The Body Shop Strawberry Clearly Glossing Conditioner, 8.4 Fl Oz (Vegan)",Conditioner,Conditioner The Body Shop Strawberry Clearly Glossing 8.4 Fl Oz,"['Item form:Conditioner', 'Specialty:Vegan']"
"Fresh Monster Detangler Spray For Kids, Watermelon | Toxin-Free, Hypoallergenic & Natural (2 pack)",Conditioner,Conditioner Fresh Monster Watermelon,"['Benefit:Detangler', 'Item form:Spray', 'Hair type:Kids', 'Specialty:Natural', 'Pack size:2 pack']"
"ATTITUDE Super Leaves, Hypoallergenic Nourishing & Strenghtening Conditioner, Grapeseed Oil & Olive Leaves, 8 Fluid Ounce",Conditioner,Conditioner ATTITUDE Super Leaves Strenghtening Grapeseed Oil & Olive Leaves 8 Fluid Ounce,"['Specialty:Hypoallergenic', 'Item form:Conditioner']"
Avlon KeraCare Natural Textures Leave In Conditioner - 16 oz,Conditioner,Conditioner Avlon KeraCare Natural Textures 16 oz,['Item form:Leave In Conditioner']
"Camille Rose Naturals Curl Love Moisture Milk, (2 Pack of 8 Ounce)",Conditioner,Conditioner Camille Rose Naturals Curl Love Moisture Milk,"['Pack size:2 Pack', 'Volume:8 Ounce']"
"Sulfur 8 Medicated Light Formula Anti-Dandruff Conditioner, 7.25 Ounce (STRICKLAND240150)",Conditioner,Conditioner Light Formula Anti-Dandruff 7.25 Ounce,"['Brand:Sulfur 8', 'Item form:Conditioner']"
Zenia Cassia Obovata (Neutral Henna) Natural Hair Conditioner 200 grams,Conditioner,Conditioner Zenia Cassia Obovata (Neutral Henna) 200 grams,"['Specialty:Natural', 'Item form:Hair Conditioner']"
African Pride Shea Miracle Silky Curls Moisturizer 12 Ounce (354ml),Conditioner,Conditioner African Pride Shea Miracle Moisturizer 12 Ounce (354ml),['Hair type:Curls']
"Bumble and Bumble While You Sleep Damage Repair Masque, 6.4 Fl Oz",Conditioner,Conditioner Bumble and Bumble While You Sleep Damage Repair Masque 6.4 Fl Oz,[]
Suave Kids Detangler Spray For Tear-Free Styling Silly Apple Dermatologist-Tested Hair Detangler Formula 10 oz,Conditioner,Conditioner Suave Hair Detangler Formula Silly Apple Dermatologist-Tested 10 oz,"['Hair type:Kids', 'Item form:Spray']"
"L'Oreal Paris EverCurl Hydracharge Leave-In Cream, 6.0 Fluid Ounce",Conditioner,Conditioner L'Oreal Paris EverCurl Hydracharge Leave-In Cream 6.0 Fluid Ounce,[]
Creme of Nature with argan oil - Strength & Shine Leave-In Conditioner - 250 mL / 8.45 Fl Oz.,Conditioner,Conditioner Creme of Nature argan oil Strength & Shine Leave-In Conditioner 250 mL / 8.45 Fl Oz,[]
"KMS MOISTREPAIR Conditioner, 25.3 oz",Conditioner,Conditioner KMS MOISTREPAIR 25.3 oz,['Item form:Conditioner']
"Cremo Beard and Scruff Softener, Mint, 6 Fl Oz",Conditioner,Conditioner Cremo Beard and Scruff Softener Mint 6 Fl Oz,[]
"Rene Furterer TRIPHASIC Texturizing Detangling Conditioner, Thinning Hair, Men & Women 5 Fl Oz",Conditioner,Conditioner Rene Furterer TRIPHASIC Thinning Hair 5 Fl Oz,"['Benefit:Detangling', 'Item form:Conditioner', 'Gender:Men & Women']"
"milk_shake Incredible Milk, 5.1 Fl Oz",Conditioner,Conditioner milk_shake Incredible Milk 5.1 Fl Oz,[]
Grave Before Shave Gentlemen's Blend Beard Butter,Conditioner,Conditioner Grave Before Shave Gentlemen's Blend Butter,['Hair type:Beard']
