input,category,context,filter
 Running glasses 3 Lens fast Photochromic Cycling Sunglasses Goggles Men Sport Road Mtb Bike Discoloration Glasses Eyewear,Eyewear,Eyewear,"['Lenses Optical Attribute:Photochromic', 'Model Number:Discoloration', 'Sport Type:Cycling']"
INBIKE Unisex Multi UV400 Bicycle Glasses with Belt Sport Cycling Sunglasses Polarized Photochromic Eyewear Men Ciclismo Glasses,Eyewear,Eyewear INBIKE,"['Sport Type:Cycling', 'Gender:Unisex', 'Lenses Optical Attribute:Polarized', 'Frame Color:Multi', 'Name:Bicycle Glasses', 'Name:Sport Cycling Sunglasses', 'Name: Photochromic Eyewear Men']"
world wind #3001Unisex Cycling Sunglasses Polarized Cycling Eyewear,Eyewear,Eyewear,"['Sport Type:Cycling', 'Gender:Unisex']"
POLISI Men Women Ski Goggles Snow Skiing UV400 Spheral Anti-Fog Lens Eyewear Winter Windproof Snowboard Esqui Skate Glasses,Eyewear,Eyewear,"['Sport Type:Skiing', 'Lenses Optical Attribute:UV400', 'Gender:Men', 'Brand Name:POLISI']"
WUKUN Badman Outdoor Sport Polarized Glasses Alloy Frame Cycling Glasses Bike Goggles Riding Eyewear Oculos Gafas OO6020,Eyewear,Eyewear,"['Sport Type:Cycling', 'Frame Material:Alloy', 'Lenses Optical Attribute:Polarized']"
NEW Unisex Sport Sun Glasses Cycling Bicycle Bike Outdoor Eyewear Men Women Sunglasses  Goggle Gifts ,Eyewear,Eyewear,"['Gender:Men', 'Eyewear Type:Sunglasses']"
MELIFE Polarized UV400 Skiing Glasses Cycling Bike Eyewear Unisex Sports Sunglasses Fishing Men Outdoor Motocross Eyewear Goggle,Eyewear,Eyewear,"['Sport Type:Skiing', 'Brand Name:MELIFE', 'Lenses Optical Attribute:UV400']"
Peter Sagan Cycling Glasses Men Bicycle Sunglasses Women Big Frame Goggles Bike Eyewear Sports Glasses UV400 Gafas Ciclismo,Eyewear,Eyewear,"['Lenses Optical Attribute:UV400', 'Sport Type:Cycling']"
New Cycling Glasses Bike Eyewear Polarized Sports Sunglasses MTB Bicycle Goggles Riding Fishing Cycling Eyewear Myopia C108G,Eyewear,Eyewear C108G,"['Lenses Optical Attribute:Polarized', 'Sport Type:Cycling']"
2018 Bestselling Cycling Glasses UV 400 Mountain Bike Eyewear Sports Sunglasses Bicycle Goggles Drop Shipping  Available,Eyewear,Eyewear,['Sport Type:Cycling']
WoSporT Men Women Ski Goggles UV 400 Anti-Fog Ski Eyewear Winter Snowboard Glasses Skiing Goggles Snowboarding Glasses,Eyewear,Eyewear,"['Sport Type:Skiing', 'Gender:Men', 'Brand Name:WoSporT']"
VICTGOAL Polarized Cycling Glasses UV400 Outdoor Sport Men Women Running Cycling Sunglasses Mountain Bike Eyewear 5 Lens Goggles,Eyewear,Eyewear,"['Sport Type:Cycling', 'Gender:Men', 'Function:Cycling Glasses']"
Snowboard Ski Goggles Men Women Anti-fog Snow Glasses Eyewear gafas snow okulary narciarskie Skiing Snowboard Goggles Glasses,Eyewear,Eyewear,"['Sport Type:Skiing', 'Gender:Men']"
Men/Women Polarized Skiing Eyewear Ski Goggles Anti-UV/Anti Glare/Windproof Glasses Bike Cycling Sportswear Grey/Colorful/Yellow,Eyewear,Eyewear,"['Sport Type:Skiing', 'Gender:Men']"
2018 New Cycling Eyewear Unisex Outdoor Sunglass UV400 Bike Cycling Glasses Bicycle Sports Sun Glasses Riding Goggles,Eyewear,Eyewear,"['Sport Type:Cycling', 'Gender:Unisex']"
Sport Glasses Cycling Eyewear Fishing Riding Bicycle Sunglasses Men Women Mountain Bike Goggles Tactical,Eyewear,Eyewear,['Sport Type:Cycling']
POLISI Winter Outdoor Skiing Glasses Polarized Snowmobile Snow Eyewear Men Women Double Layer Anti-Fog Lens Snowboard Goggles,Eyewear,Eyewear,"['Brand Name:POLISI', 'Lenses Optical Attribute:Polarized', 'Gender:Men', 'Sport Type:Skiing']"
Brand Polarized Sports Men Sunglasses Road Cycling Glasses Mountain Bike Bicycle Riding Protection Goggles Mtb Unisex Eyewear,Eyewear,Eyewear,"['Sport Type:Cycling', 'Gender:Unisex']"
Ski Goggles Replaceable Magnetic Lenses UV400 Anti-fog Ski Mask Skiing Men Women Snow Snowboard Goggles Ski Glasses Eyewear,Eyewear,Eyewear,['Sport Type:Skiing']
ZONEBIKE Cycling Glasses Men Women Polarized Bike Eyewear Outdoor Sports Bicycle Sunglasses Goggles 3 Lenses Fietsbrillen,Eyewear,Eyewear,"['Brand Name:ZONEBIKE', 'Lenses Optical Attribute:Polarized', 'Sport Type:Cycling']"
ROCKBROS Skiing Glasses Double-Layer Anti-Fog MTB Cycling Snow Snowboard Goggles Ski Mask Eyewear For Adults And Children,Eyewear,Eyewear,"['Brand Name:ROCKBROS', 'Sport Type:Skiing']"
2018 Top Cycling Glasses 3 lens UV400 Bicycle Cycling Sunglasses Men/Women Sport Road Bike Cycling Eyewear Gafas ciclismo,Eyewear,Eyewear,"['Lenses Optical Attribute:UV400', 'Sport Type:Cycling']"
Pro Photochromic Cycling Glasses Racing Bicycle Eyewear Polarized Mountain Bike Sun Glasses Cycling Sunglasses,Eyewear,Eyewear,['Sport Type:Cycling']
HD Ski Goggles Men Women UV-protection Glasses Anti-fog CyclingPOC Hiking Outdoor Sport Eyewear Snowboard Snowmobile Skiing Goggles,Eyewear,Eyewear,"['Sport Type:Skiing', 'Gender:Men']"
POLISI Winter Skiing Skate Goggles Outdoor Sport UV400 Snowboard Eyewear Double Layer Anti-Fog Lens Ski Skateboard Snow Glasses,Eyewear,Eyewear,"['Brand Name:POLISI', 'Lenses Optical Attribute:UV400', 'Sport Type:Skiing']"
ROBESBON New Cycling Goggles 3 Lens Anti-uv Bike Glasses High Quality Bicycle Glasses Eyewear Las gafas Sunglasses ,Eyewear,Eyewear,"['Sport Type:Cycling', 'Brand Name:ROBESBON', 'Feature:Anti-uv']"
Zacro Cycling Glasses UV400 Sunglasses Men Polarized Sport Bike Bicycle Sun Glasses Driving Cycling Goggles Fishing Eyewear,Eyewear,Eyewear Zacro,"['Sport Type:Cycling', 'Lenses Optical Attribute:Polarized']"
Professional Ski Goggles Double Layer Lens Anti-Fog Unisex Men Women Outdoor Skiing Sport Snowboard Goggle Skiing Eyewear,Eyewear,Eyewear,"['Model Number:Skiing Eyewear', 'Lenses Optical Attribute:Anti-Fog', 'Gender:Men', 'Sport Type:Skiing']"
Professional Double Layers UV400 Protection Goggles Anti-fog Big Ski Mask Glasses Skiing Men Women Snow Snowboard skiing Eyewear,Eyewear,Eyewear UV400 Protection,"['Sport Type:Skiing', 'Gender:Men']"
Kids Skiing Eyewear For Child Ski Snowboard Goggles Boys Girls Double UV400 Anti-fog Professional Ski Goggles with Bag,Eyewear,Eyewear,"['Sport Type:Skiing', 'Gender:Boys', 'Name:Skiing Eyewear']"
Hot! Polarized Cycling Sunglasses Outdoor Sports Bicycle Glasses Bike Sunglasses 77g Goggles Eyewear Oculos Ciclismo #4MY10,Eyewear,Eyewear,"['Sport Type:Cycling', 'Lenses Optical Attribute:Polarized']"
Cycling Eyewear Outdoor Sport Sun Glasses UV400 MTB Bike Bicycle Cycling Glasses Bike Sunglasses Windproof Eyewear M06Aug NO,Eyewear,Eyewear,"['Lenses Optical Attribute:UV400', 'Model Number:Cycling Eyewear', 'Sport Type:Cycling']"
Ski Goggles Spherical Double Layers Anti-Fog Snow Ski Mask Glasses Skiing Men Women Snow Snowboard Goggles Eyewear Ski Glasses,Eyewear,Eyewear,"['Sport Type:Skiing', 'Gender:Women']"
Men Women Sport Cycling Glasses Outdoor Bicycle Sunglasses Eyewear UV400 Lens,Eyewear,Eyewear,"['Lenses Optical Attribute:UV400', 'Sport Type:Cycling']"
OSHOW Ski Goggles Double Lens Women Snow Sunglasses Helmet Accessories Ski Sunglasses For Snowboard Anti-fog Skiing Eyewear,Eyewear,Eyewear OSHOW,['Sport Type:Skiing']
New Men Polarized Sunglasses HD Bicycle Sun Glasses Small Frame Narrow Face Light Safe Outdoor Sports Goggles Cycling Eyewear,Eyewear,Eyewear,"['Sport Type:Cycling', 'Gender:Men']"
2018 Cycling Driving Men&#39;s Photochromic Polarized Sunglasses Vintage Eyewear for Men Women Coating Points UV400 Male Sun Glasses,Eyewear,Eyewear,"['Gender:Men', 'Sport Type:Cycling']"
Kids Skiing Eyewear For Child Ski Snowboard Goggles Boys Girls Double UV400 Anti-fog Professional Ski Goggles,Eyewear,Eyewear,"['Sport Type:Skiing', 'Gender:Boys', 'Name:Skiing Eyewear']"
Brand Ski Goggles Double Layers UV400 Anti-fog Big Ski Mask Eyewear Glasses Skiing For Men and Women Snow Goggles ,Eyewear,Eyewear,"['Sport Type:Skiing', 'Gender:Men', 'Lenses Optical Attribute:UV400']"
Brand Polarized Cycling SunglassesSports  Road Mountain Bike Bicycle galsses  MTB Riding Running Goggles Eyewear Flight jacketer,Eyewear,Eyewear,"['Sport Type:Cycling', 'Eyewear Type:Sunglasses']"
Skiing Eyewear Glasses Men Women Breathable Double Layers Anti-Fog UV400 Outdoor Sports Multi Colors Snow Skating Ski Goggles ,Eyewear,Eyewear,"['Sport Type:Skiing', 'Gender:Women', 'Frame Color:Multi', 'Lenses Color:Multi', 'Lenses Optical Attribute:UV400']"
Outdoor Snowboard Ski Goggles Eyewear Off-Road Sports Glasses Stripe Frame Protective Eyewear Skiing UV400 Snowboard Glasses,Eyewear,Eyewear,"['Sport Type:Skiing', 'Model Number:Ski Goggles']"
Fantastic Cycling Eyewear Women Unisex Chic Shades Acetate Frame UV Glasses Sunglasses Ultraviolet Eyeglasses Popular Spectacles,Eyewear,Eyewear,"['Sport Type:Cycling', 'Gender:Women']"
Winter Girls Boys Eyewear Ski Goggles Kids Double Lens UV400 Anti-fog Ski Snow Child Skiing Glasses ,Eyewear,Eyewear,"['Sport Type:Skiing', 'Gender:Girls']"
"POLISI Professional Ski Glasses Double Layer Lens Snow Goggles UV Protection Anti-Fog Snowboard Skiing Eyewear, Orange Lens",Eyewear,Eyewear,"['Sport Type:Skiing', 'Brand Name:POLISI']"
Ski Goggles With Case Double Lens UV400 Anti-fog Ski Snow Glasses Skiing Men Women Winter Snowboard Eyewear ,Eyewear,Eyewear,"['Sport Type:Skiing', 'Gender:Men']"
100 speedcraft Cycling Sunglasses Polarized Men Sport Mtb Mountain Bike Glasses Eyewear Men Goggles Peter Sagan FJ,Eyewear,Eyewear,"['Lenses Material:Polarized', 'Sport Type:Cycling']"
Cycling Glasses Bike Glasses Outdoor Sports MTB Bicycle Sunglasses Goggles Eyewear FOR Men Women,Eyewear,Eyewear,['Sport Type:Cycling']
Brand Bollfo 6 Colors Full Package TR90 Tactical Goggles Men Sunglasses Eyewear Outdoor Golf Fishing Cycling Gafas sports glass,Eyewear,Eyewear,['Sport Type:Cycling']
OBAOLAY Ski Goggles Box Protection Snowboard Goggles Carrying Case Storage Bag Women Eyewear Snow Glasses Cover,Eyewear,Eyewear,[]
Men Women Ski Glasses Dustproof Anti Fog Skiing Eyewear Windproof Uv400 Sports Snow Goggles,Eyewear,Eyewear,"['Sport Type:Skiing', 'Gender:Men']"
RBESBON Cycling Glasses UV400 Cycling Glasses Men Women Bicycle Glasses MTB Sports Sunglasses Hiking Fishing Running Eyewear,Eyewear,Eyewear,"['Sport Type:Cycling', 'Lenses Optical Attribute:UV400', 'Feature:Cycling Glasses', 'Feature:Sports Sunglasses']"
Windproof Sport Eyewear Cycling Glasses Outdoor Motocross Sunglasses Snowboard Goggles Gifts Ski Googles Double Lens,Eyewear,Eyewear,['Lenses Optical Attribute:Goggle']
Cycling Glasses Men Summer Style Outdoor Women Mountain Bike Riding bicicleta Sport Protective Sunglasses Eyewear Gafas ciclismo,Eyewear,Eyewear,['Sport Type:Cycling']
SOARED Men Women Snowboard Skate Eyewear Double Layer Anti-Fog Gray Lens Snow Skiing Goggles UV Protection Anti-Fog Ski Glasses,Eyewear,Eyewear,"['Sport Type:Skiing', 'Gender:Men']"
UV400 Snowboard Goggles Glasses Winter Snow Sports Skiing Goggles Men Women Anti-fog Skiing Eyewear Double Layers Ski Glasses   ,Eyewear,Eyewear,"['Sport Type:Skiing', 'Gender:Men']"
Portable Ski Goggles Unisex Anti-fog Snowboarding Eyewear Windproof TPU+PC Goggles Myopia Outdoor Skiing Skating Sports Glasses,Eyewear,Eyewear,"['Sport Type:Skiing', 'Frame Material:TPU']"
2018 Hot Sale Promotion Snowboarding Sunglasses Women Skiing Eyewear Ski Glasses Goggles Available Snowboard Women Snow Googles ,Eyewear,Eyewear,"['Sport Type:Skiing', 'Gender:Women', 'Model Number:Skiing Eyewear']"
2018 Hot Cycling Glasses Gift High Quality Men Women UV400 MTB Bike Bicycle Sunglasses Outdoor Sports Eyewear Gafas Ciclismo,Eyewear,Eyewear,['Sport Type:Cycling']
Top Quality Sports Unisex Women&#39;s Cycling sunglasses Vintage Eyewear Square Frame Mirror Lens goggle Hot,Eyewear,Eyewear,"['Sport Type:Cycling', 'Gender:Unisex']"
Fan Version Cooler Airsoft Tactical Googles Glass Paintball Eyewear Protection Cs Wargame Goggle for Snowing Skating Hiking,Eyewear,Eyewear,[]
POLISI New Arrival Children Prevents Goggles Boy Girl Riding Bike Bicycle Sunglasses Polarized Glasses Outdoor Sports Eyewear,Eyewear,Eyewear,"['Brand Name:POLISI', 'Lenses Optical Attribute:Polarized']"
NEWBOLER 5 Lens Cycling Glasses Women Polarized Racing Sport Sunglasses TR90 UV400 Cycling Eyewear Bike Bicycle Goggles,Eyewear,Eyewear,"['Sport Type:Cycling', 'Gender:Women', 'Brand Name:NEWBOLER']"
3 Lens Man Woman Polarized Bike Cycling glasses  Sport Outdoor Goggles ciclismo Bicycle Cycling Eyewear Cycling Sunglasses,Eyewear,Eyewear,['Sport Type:Cycling']
UV400 Cycling Glasses Colorful Men Women Sport Cycling Eyewear Bicycle Sports Sun Glasses Bike Goggles Glasses for Bicycles,Eyewear,Eyewear,['Sport Type:Cycling']
Skiing Goggle Skiing Eyewear Anti Fog Anti Snowblindness Protect Eyes and Face for  Men Women and Children Do Outdoor Sports.,Eyewear,Eyewear,"['Sport Type:Skiing', 'Gender:Women']"
Children Double Lens Ski Goggles Anti-fog UV400 for Outdoor Sports Skiing Goggles Snow Snowboard Protective Glasses Eyewear,Eyewear,Eyewear,"['Lenses Optical Attribute:-', 'Sport Type:Skiing']"
New Ski Goggles Men Women Snow Snowboard Googles Skiing Eyewear Mens Mask Glasses UV Protection Snowmobile Skiing Skating Mask,Eyewear,Eyewear,"['Gender:Men', 'Sport Type:Skiing']"
Anti-Fog Ski Goggles Men Women Double Lens Outdoor Mountaineering Glasses Skiing Eyewear Anti-Air Skiing Snowboard Goggles,Eyewear,Eyewear,"['Model Number:Ski Goggles', 'Gender:Men', 'Sport Type:Skiing']"
2018 Polarized Cycling Sunglasses Outdoor Sport Bicycle SunGlasses Cycling Glasses Cycling Goggle Bike Eyewear 4 Lenses YJ4,Eyewear,Eyewear Goggle Bike Eyewear Sunglasses Outdoor Sport,"['Sport Type:Cycling', 'Lens Width:1', 'Lens Height:1']"
New Professional Unisex Ski Goggles Adult Kids Big Mask Ski Mask Glasses Men Women Riding Climbing Hiking Snow Skiing Eyewear,Eyewear,Eyewear Skiing Eyewear,"['Gender:Men', 'Model Number:Skiing Eyewear', 'Sport Type:Skiing']"
COPOZZ Children of 4-15 Years Old Ski Snowboard Goggles Mountain Skiing Eyewear Snowmobile Winter Sport Gogle Snow Glasses,Eyewear,Eyewear,"['Sport Type:Skiing', 'Lenses Optical Attribute:-', 'Lens Height:-', 'Brand Name:COPOZZ', 'Lens Width:-']"
ZONEBIKE Ski Snowboard Goggles Mountain Skiing Eyewear Snowmobile Winter Sport Google Snow Glasses,Eyewear,Eyewear,"['Brand Name:ZONEBIKE', 'Sport Type:Skiing']"
Men&#39;s Women Winter Big Ski Goggles Double Outdoor Sport Anti-fog Eyewear Snowboarding Cycling Skiing Hiking UV400 Glasses,Eyewear,Eyewear,"['Sport Type:Skiing', 'Gender:Men']"
POC Crave 5 Lens Photochromic Mountain Bike Glasses Polarized Cycling Glasses Ciclismo Eyewear Sport Cycling SunGlasses ,Eyewear,Eyewear,['Sport Type:Cycling']
2017 Skiing Goggles Mask 720P HD 1080P Camera Video Camcorder UV Anti-fog Men Women Snowboard Glasses Action Camera Ski Eyewear,Eyewear,Eyewear,"['Sport Type:Skiing', 'Gender:Men']"
POLISI Men Women Winter Ski Goggles Outdoor Sports Snowmobile Snowboard Skate Snow Glasses UV400 Anti-Fog Skiing Eyewear,Eyewear,Eyewear,"['Sport Type:Skiing', 'Lenses Optical Attribute:UV400', 'Gender:Men', 'Brand Name:POLISI']"
Children Sports Eyewear Goggles PC Lens Protective Eye Glasses Child Eyewear Goggles Kids for Outdoor Soccer Cycling Basketball ,Eyewear,Eyewear,['Sport Type:Cycling']
NEWBOLER 5 Lens Cycling Glasses Polarized Racing Sport Sunglasses Men TR90 UV400 Cycling Eyewear Bike Bicycle Goggles,Eyewear,Eyewear,"['Sport Type:Cycling', 'Gender:Men', 'Brand Name:NEWBOLER']"
Unisex Anti-fog Anti-slip Skiing Eyewears shockproof Double Lens Ski Goggles TPU Frame Ski Goggles for Adults Skiing 7 Colors,Eyewear,Eyewear,"['Sport Type:Skiing', 'Gender:Unisex']"
Children UV400 Protection Ski Goggles Anti-fogging Goggles Skiing OTG Goggle Climbing Skating Snow Sports Eyewear Glass for Kids,Eyewear,Eyewear,['Sport Type:Skiing']
PHMAX Polarized Cycling Eyewear Cycling Glasses Bicycle Sunglasses TR90 Frame Bike Sunglasses Riding Protection Cycling Goggles,Eyewear,Eyewear,"['Brand Name:PHMAX', 'Sport Type:Cycling']"
Ski Goggles Face Mask Women Men PC Lens TPU Frame Plain Glass Windproof Eyewear Outdoor Sports Glasses,Eyewear,Eyewear,"['Gender:Men', 'Frame Material:TPU', 'Model Number:Ski Goggles', 'Lenses Material:Glass']"
Cycling Eyewear Unisex Outdoor Sunglass UV400 Anti-UV Cycling Glasses Polarized MTB Bicycle Sun Glasses Riding Goggles C102G,Eyewear,Eyewear C102G,"['Lenses Optical Attribute:Polarized', 'Gender:Unisex', 'Sport Type:Cycling']"
POLISI Winter Ski Snow Snowboard Goggles Anti-Fog Lens Snowmobile Motocross Goggles Men Women Skiing Snowboarding Eyewear,Eyewear,Eyewear,"['Sport Type:Skiing', 'Gender:Men']"
Peter sagan Cycling Glasses Men Mountain Bike Goggles Bicycle Sport Sunglasses Men Women MTB Cycling Eyewear Oculos Ciclismo,Eyewear,Eyewear,['Sport Type:Cycling']
100% speedtrap speedcraft Polarized Cycling SunGlasses Mountain Bike Goggles Sport Eyewear MTB Bicycle Glasses Peter Sagan,Eyewear,Eyewear,['Sport Type:Cycling']
Ski Goggles Men Women Snowboard Goggle Glasses Skiing UV400 Protected Anti-fog Snow Skiing Eyewear Glasses Anti-fog Ski Mask,Eyewear,Eyewear,"['Sport Type:Skiing', 'Gender:Men']"
ZONEBIKE Oculos Ciclismo UV400 Goggles Cycling Sunglasses Bicycle Glasses Green Bicicleta Mountain Bike Sunglass Sports Eyewear,Eyewear,Eyewear,"['Brand Name:ZONEBIKE', 'Lenses Optical Attribute:UV400', 'Sport Type:Cycling']"
POLISI Winter Outdoor Ski Snow Goggles Double Layer Anti-Fog Lens Skiing Snowboard Glasses UV400 Men Women Snowmobile Eyewear,Eyewear,Eyewear,"['Sport Type:Skiing', 'Gender:Men', 'Brand Name:POLISI']"
OBAOLAY Double Layers Anti-Fog Ski Goggles Men Women Sports Glasses Skiing Mask Snow Sunglasses Snowboarding Eyewear,Eyewear,Eyewear,"['Brand Name:OBAOLAY', 'Gender:Men', 'Sport Type:Skiing']"
WoSporT Winter Snow Sports Skiing Snowboard Snowmobile Anti-fog Goggles Windproof Dustproof Glasses Men Women Eyewear,Eyewear,Eyewear,"['Sport Type:Skiing', 'Brand Name:WoSporT']"
Protection Ski Eyewear Case Large Snow Skiing Goggles Box Shockproof Waterproof Snowboard Bag Skiing Equipment,Eyewear,Eyewear,['Sport Type:Skiing']
Ultra Light PC Camera Glasses Bicycle Sunglasses Bike Glasses Eyewear Lens Goggles Spectacles UV Proof Motorcycle Sports ,Eyewear,Eyewear,['Feature:Camera Glass']
NEWBOLER 2018 Cycling Sunglasses Men Women Bicycle Eyewear 3 Polarized Lenses Cycling glasses myopia  Mountain MTB Bike Goggles,Eyewear,Eyewear,"['Sport Type:Cycling', 'Brand Name:NEWBOLER']"
Outdoor Cycling Glasses Bicycle Bike Sport Sunglasses Polarized Gafas Ciclismo Riding Eyewear Goggles Man Oculos De Ciclismo,Eyewear,Eyewear,"['Sport Type:Cycling', 'Model Number:Sunglasses']"
Winter Ski Goggles UV 400 Anti-fog Glasses TPU+PC Skiing Eyewear 2layers Lens Outdoor Sports Goggles Skating Snowboard Glasses,Eyewear,Eyewear,['Sport Type:Skiing']
Windproof Double Layers Ski Goggles Men Women Snowboard Glasses UV400 Protection Snow Skiing Eyewear Anti-fog Ski Mask,Eyewear,Eyewear,"['Sport Type:Skiing', 'Gender:Men']"
Anti-fogging Skiing Goggles Children UV400 Protection OTG Ski Goggle Climbing Skating Snow Winter Sports Eyewear Glass for Kids,Eyewear,Eyewear  Skiing Goggles,['Sport Type:Skiing']
Polarized Cycling Sunglasses Men Bike Glasses Sport Bicycle Goggles 5 Lenses Eyewear gafas ciclismo lunette de soleil homme.A51,Eyewear,Eyewear,"['Sport Type:Cycling', 'Gender:Men', 'Lenses Optical Attribute:Polarized', 'Model Number:Cycling Sunglasses']"
Eyewear Anti-UV Ski Windproof Goggles Ski Goggles Anti-fog Big Ski Mask Glasses Skiing Men Women Snow Snowboard Goggles ,Eyewear,Eyewear Goggle,"['Sport Type:Skiing', 'Lens Height:-', 'Lenses Optical Attribute:-', 'Lens Width:-']"
Peter sagan speedtrap Outdoor Cycling Glasses Mountain Bike Goggles Bicycle Sport Sunglasses Big Frame MTB Cycling Eyewear,Eyewear,Eyewear,['Sport Type:Cycling']
5 Lens Polarized Cycling Glasses Outdoor Sports Cycling Sunglasses Men UV400 Breaker MTB Cycling Eyewear Bike Bicycle Goggles,Eyewear,Eyewear,"['Sport Type:Cycling', 'Lenses Optical Attribute:Polarized']"
Big Vision Adults Eyewear Adjustable Buckle Ski Goggle Mask Windproof Glasses Single Layer For Men Women,Eyewear,Eyewear,"['Gender:Men', 'Lenses Optical Attribute:Goggle']"
SOARED Men Women UV 400 Anti-fog Ski Goggles Snow Skiing Snowboard Skateboard Motocross Goggles Ski Eyewear,Eyewear,Eyewear,"['Sport Type:Skiing', 'Gender:Men']"
High Quality Skiing Eyewear Snowboard Goggles Men Women Snow Ski Googles Glasses,Eyewear,Eyewear,"['Sport Type:Skiing', 'Gender:Men']"
New arrivals Jokvie Cycling Eyewear Outdoor Bicycle Glasses Polarized Anti-Explosion Sunglasses Fish Hiking Running Glasses,Eyewear,Eyewear,['Sport Type:Cycling']
New Adults Double Lens Ski Goggles Anti-fog Skiing Goggles Snow Snowboard Protective Glasses Eyewear drop shipping,Eyewear,Eyewear,"['Sport Type:Skiing', 'Lenses Optical Attribute:-']"
2018 4 Lens TR90 Ski Goggles Polarized Cycling Sunglasses  Men Sport Road Mtb Mountain Bike Glasses Riding Eyewear UV400 Myopia,Eyewear,Eyewear,"['Frame Material:TR90', 'Lenses Optical Attribute:Polarized', 'Sport Type:Cycling']"
1PC Bike Cycling Sunglasses Fishing Eyewears Driving Riding Anti-UV Sunglasses Safety Glasses Outdoor Sports Eyewear PJ4,Eyewear,Eyewear,"['Lenses Material:Glass', 'Sport Type:Cycling']"
ROCKBROS Men Women Ski Goggles Winter Sport Double Layers Anti-Fog Glasses Snow Skiing UV400 Eyewear Snowboard PC Lens Big Mask ,Eyewear,Eyewear Skiing,"['Sport Type:Skiing', 'Brand Name:ROCKBROS']"
BOLLFO Unisex Anti-fog Skiing Goggles UV Protection Wide Vision Skiing Eyewears for adults outdoor sports 4 Colors,Eyewear,Eyewear UV Protection,"['Sport Type:Skiing', 'Gender:Unisex']"
WoSporT Outdoor Skiing Snowboard Men Women Anti-fog Double Goggles Windproof Dustproof Glasses Ski Sunglasses Eyewear,Eyewear,Eyewear,"['Sport Type:Skiing', 'Brand Name:WoSporT']"
POLISI Professional Skiing Snow Goggle Double Layer Anti-Fog Orange Lens Skateboard Glasses UV Protection Ski Snowboard Eyewear,Eyewear,Eyewear,"['Sport Type:Skiing', 'Brand Name:POLISI']"
POLISI Winter Skiing Snowboard Eyewear Replaceable 2 Lenses Anti-Fog Goggles Men Women UV400 Snowmobile Ski Skate Snow Glasses,Eyewear,Eyewear,"['Sport Type:Skiing', 'Gender:Men', 'Brand Name:POLISI', 'Lenses Optical Attribute:UV400']"
Protection EVA Eyewear Case Large Snow Skiing Goggles Box Shockproof Bag,Eyewear,Eyewear,['Sport Type:Skiing']
NEWBOLER 6 Lens Cycling Sunglasses Polarized Outdoor Sports Bicycle Bike Sun Glasses PC Goggles Eyewear Bicycle Accessory,Eyewear,Eyewear,"['Sport Type:Cycling', 'Lenses Optical Attribute:Polarized', 'Brand Name:NEWBOLER', 'Frame Material:PC']"
3 Lenses Unisex UV400 Polarized Cycling Eyewear MTB Bike Bicycle Racing Windproof Goggles Outdoor Sport Glasses Sunglasses C0020,Eyewear,Eyewear C0020,"['Gender:Unisex', 'Sport Type:Cycling']"
SAENSHING Snowboard Goggles Winter Ski Glasses Double Lens Skiing Motocross Outdoor Anti-fog Snow Googles Snowboarding Eyewear ,Eyewear,Eyewear Snowboard Goggles,"['Sport Type:Skiing', 'Type:Snowboard Goggles', 'Type:Ski Glasses', 'Type:Snow Googles']"
LongKeeper Retro Cycling Sunglasses Mens Night Vision Polarized Sunglasses Outdoor Biking Goggles Sports Eyewear Sun Glasses 104,Eyewear,Eyewear,"['Sport Type:Cycling', 'Gender:Men', 'Lenses Optical Attribute:Polarized']"
2018 UV400 Cycling Eyewear Bike Bicycle Sports Glasses Hiking Men Motorcycle Sunglasses Reflective Explosion-proof Goggles,Eyewear,Eyewear,"['Sport Type:Cycling', 'Lenses Optical Attribute:UV400']"
VICTGOAL Polarized Cycling Glasses Unisex TR90 Bicycle Sunglasses Outdoor Sport MTB Fishing Running Cycling Bike Eyewear 5 Lens ,Eyewear,Eyewear,"['Sport Type:Cycling', 'Lenses Optical Attribute:Polarized', 'Function:Cycling Glasses', 'Function:Bike Eyewear']"
Gurensye UV400 Cycling Glasses Men Women MTB Bike Eyewear Bicycle Glasses Outdoor Sports Bike Sunglasses Goggles Oculos Cclismo,Eyewear,Eyewear Gurensye,['Sport Type:Cycling']
For Dropship!! Cycling Eyewear Glasses Bike Goggles for Outdoor Sports Sunglasses Big Lens Spectacles Sunglasses Oculos Ciclismo,Eyewear,Eyewear,['Sport Type:Cycling']
Muti-color Men Summer Sports Glasses Anti-impact Eyewear  Basketball Football Anti-collision Eye  Protector Goggles Bike Glasses,Eyewear,Eyewear,[]
WoSporT Winter Snow Sports Skiing Snowboard Snowmobile Anti-fog Goggles Windproof Glasses UV400 Skate Ski Sunglasses Eyewear,Eyewear,Eyewear,"['Sport Type:Skiing', 'Brand Name:WoSporT', 'Lenses Optical Attribute:UV400']"
Time-limited Multi Acetate Gafas Ciclismo New Ski Uv400 Goggles Big Mask Anti-wind Skiing Eyewear Women Snow Snowboard ,Eyewear,Eyewear,"['Sport Type:Skiing', 'Lenses Color:Multi', 'Gender:Women', 'Frame Material:Acetate', 'Frame Color:Multi', 'Model Number:Skiing Eyewear']"
KUTOOK Ski Goggles Double Lens Anti-fog UV Protection For Men Women Windproof Glasses Eyewear Skiing Snow Snowboard Goggles,Eyewear,Eyewear KUTOOK,"['Sport Type:Skiing', 'Gender:Men']"
WOLFBIKE Outdoor Windproof Glasses Ski Goggles Snowboarding Skate Goggles Anti-fog Snow Skiing Sun Glasses Eyewear 4 Color,Eyewear,Eyewear,"['Sport Type:Skiing', 'Name:Ski Goggles']"
New Ski Goggles with Removeable Lens UV400 Protection Anti-fog Snowboarding Snow Goggles Skiing Eyewear for Men &amp; Women Adults,Eyewear,Eyewear,"['Sport Type:Skiing', 'Gender:Men']"
Brand 3 Lens Man Woman JBR  Bike Cycling Sunglasses Sport Outdoor Goggles ciclismo Bicycle Cycling Eyewear Cycling glasses,Eyewear,Eyewear,"['Sport Type:Cycling', 'Style:Cycling Sunglasses']"
by dhl 100pcs Ski Eyewear Snow Goggles Dustproof Anti Fog Skiing Sunglasses Windproof Protection Brand New Outdoor Sports Lens,Eyewear,Eyewear,['Sport Type:Skiing']
POLISI Professional Ski Goggles Double Layer Lens Anti-Fog UV Protection Skiing Eyewear Winter Snowboard Snow Glasses,Eyewear,Eyewear,"['Sport Type:Skiing', 'Brand Name:POLISI']"
FMA New Tactical Glasses Regulator Goggle  Eyewear Protection Regulator Fan Version Goggle Anti-Dust Ski Glasses,Eyewear,Eyewear,[]
Ski Goggles Men Women Snowboard Goggles Big Ski Mask Snow Glasses Skiing Double Lens UV400 Anti-Fog Multi Acetate Snow Eyewear,Eyewear,Eyewear,"['Sport Type:Skiing', 'Lenses Color:Multi', 'Frame Material:Acetate', 'Gender:Men', 'Frame Color:Multi']"
